{
	"https://www.olx.ua/obyavlenie/prodam-dom-v-gorenke-IDBJSkW.html#f7065a9d45": {
		"link": "https://www.olx.ua/obyavlenie/prodam-dom-v-gorenke-IDBJSkW.html#f7065a9d45",
			"Объявление от": "Бизнес",
			"Выберите рубрику": "Продажа домов",
			"Без комиссии": "Без комиссии",
			"Возможность обмена": "Возможность обмена",
			"Готов сотрудничать с риэлторами": "",
			"Этажность": "2",
			"Общая площадь": "260 м²",
			"Количество комнат": "5",
			"Площадь участка": "15 соток",
			"Тип дома": "Дом",
			"Ландшафт (до 1 км.)": "Лес\n\nОзеро",
			"price": "75 000 $",
			"description": "Объявление от    Бизнес         Выберите рубрику    Продажа домов           Без комиссии    Без комиссии         Возможность обмена    Возможность обмена           Готов сотрудничать с риэлторами             Этажность   2          Общая площадь   260 м²        Количество комнат   5          Площадь участка   15 соток        Тип дома    Дом           Ландшафт (до 1 км.)    Лес  Озеро                                                                                            Продам дом в с. Горенка 260 кв.м.,  участок 15 соток, коммуникации. Рядом лес, озеро.",
			"images": 5,
			"location": "Горенка, Киевская область, Киево-Святошинский район\n                        \n                            Показать на карте"
	},
	"https://www.olx.ua/obyavlenie/prodam-dom-v-glevahe-IDDWQyF.html#f7065a9d45": {
		"link": "https://www.olx.ua/obyavlenie/prodam-dom-v-glevahe-IDDWQyF.html#f7065a9d45",
			"Объявление от": "Частного лица",
			"Выберите рубрику": "Продажа домов",
			"Без комиссии": "Без комиссии",
			"Возможность обмена": "Возможность обмена",
			"Готов сотрудничать с риэлторами": "Готов сотрудничать с риэлторами",
			"Расстояние до ближайшего города": "до 15 км.",
			"Этажность": "2",
			"Общая площадь": "450 м²",
			"Количество комнат": "6",
			"Площадь участка": "12 соток",
			"Тип дома": "Дом",
			"Кадастровый номер": "3221455300:01:010:0419",
			"Год постройки / сдачи": "После 2015",
			"Внешнее утепление стен": "Пенопласт",
			"Тип кровли": "Металлошифер",
			"Санузел": "2 и более",
			"Отопление": "Твердотоплевное",
			"Ремонт": "Под чистовую отделку",
			"Меблирование": "Нет",
			"Бытовая техника": "Без бытовой техники",
			"Мультимедиа": "Без мультимедиа",
			"Комфорт": "Забор\n\nограждение\n\nСауна\n\nбаня\n\nГараж",
			"Коммуникации": "Газ\n\nКанализация септик\n\nЭлектричество",
			"Инфраструктура (до 500 метров)": "ЖД станция\n\nРынок\n\nОстановка транспорта\n\nМагазин",
			"Ландшафт (до 1 км.)": "Лес",
			"price": "55 000 $ Договорная",
			"description": "Объявление от    Частного лица         Выберите рубрику    Продажа домов           Без комиссии    Без комиссии         Возможность обмена    Возможность обмена           Готов сотрудничать с риэлторами    Готов сотрудничать с риэлторами         Расстояние до ближайшего города    до 15 км.           Этажность   2        Общая площадь   450 м²          Количество комнат   6        Площадь участка   12 соток          Тип дома    Дом         Кадастровый номер   3221455300:01:010:0419           Год постройки / сдачи    После 2015         Внешнее утепление стен    Пенопласт           Тип кровли    Металлошифер         Санузел    2 и более           Отопление    Твердотоплевное         Ремонт    Под чистовую отделку           Меблирование    Нет         Бытовая техника    Без бытовой техники           Мультимедиа    Без мультимедиа         Комфорт    Забор  ограждение  Сауна  баня  Гараж           Коммуникации    Газ  Канализация септик  Электричество         Инфраструктура (до 500 метров)    ЖД станция  Рынок  Остановка транспорта  Магазин           Ландшафт (до 1 км.)    Лес                                                                                            Продаётся участок 12 сот, дом 250м2, 2 этажа. второй дом 150м2 два этажа ( планировался под баню сауну ), третий домик гостиный .Фото были сделаны 2 года назад. Свет, канализационный септик, колодезь, садовые деревья тротуарная плитка. Нужны средства что бы поставить окна , двери , решётки.Продаю в таком состоянии как есть... заниматься восстановлением нет ни средств ни желания. Документы в порядке. Все интересующие вопросы в телефонном режиме. СВЕТ ПОДКЛЮЧЁН. Газовая труба проходит прямо возле нашего забора. Второй вариант: авто до 10 000$ -25 000$( укр. регистрация ) без проблемный, остальную сумму деньгами. Рассмотрим любой вариант, но желательно внедорожник.Ландшафт ровный, воздух чистый, место очень хорошее.",
			"images": 5,
			"location": "Глеваха, Киевская область, Васильковский район\n                        \n                            Показать на карте"
	},
	"https://www.olx.ua/obyavlenie/prodam-dom-s-pogreby-fasad-IDEkXlL.html#f7065a9d45": {
		"link": "https://www.olx.ua/obyavlenie/prodam-dom-s-pogreby-fasad-IDEkXlL.html#f7065a9d45",
			"Объявление от": "Бизнес",
			"Выберите рубрику": "Продажа домов",
			"Без комиссии": "",
			"Возможность обмена": "",
			"Готов сотрудничать с риэлторами": "",
			"Расстояние до ближайшего города": "до 5 км.",
			"Этажность": "2",
			"Общая площадь": "100 м²",
			"Количество комнат": "4",
			"Площадь участка": "20 соток",
			"Тип дома": "Дом",
			"Год постройки / сдачи": "1990 - 2000",
			"Тип стен": "Кирпичный",
			"Тип кровли": "Шифер",
			"Отопление": "Индивидуальное газовое",
			"Ремонт": "Жилое состояние",
			"Коммуникации": "Электричество\n\nГаз\n\nСкважина",
			"Инфраструктура (до 500 метров)": "Магазин\n\nкиоск",
			"Ландшафт (до 1 км.)": "Лес\n\nРека",
			"price": "58 000 $",
			"description": "Объявление от    Бизнес         Выберите рубрику    Продажа домов           Без комиссии             Возможность обмена               Готов сотрудничать с риэлторами             Расстояние до ближайшего города    до 5 км.           Этажность   2        Общая площадь   100 м²          Количество комнат   4        Площадь участка   20 соток          Тип дома    Дом         Год постройки / сдачи    1990 - 2000           Тип стен    Кирпичный         Тип кровли    Шифер           Отопление    Индивидуальное газовое         Ремонт    Жилое состояние           Коммуникации    Электричество  Газ  Скважина         Инфраструктура (до 500 метров)    Магазин  киоск           Ландшафт (до 1 км.)    Лес  Река                                                                                            Продам дом с.Погребы. 100 м2. Перспективное месторасположение! Фасад основной дороги. Участок 20 соток,есть возможность раздела. Кирпичный дом,автономное газовое отопление,скважина,электричество. На территории летняя кухня(приватизирована) и хоз.помещения Магазин,кафе,остановка транспорта 150м.  Идеальное предложение для инвестиции!",
			"images": 5,
			"location": "Погребы, Киевская область, Броварской район                            Посмотреть на карте"
	},
	"https://www.olx.ua/obyavlenie/ukranska-shveytsarya-uchastok-dacha-tripllya-s-halepya-IDEeNPF.html#f7065a9d45": {
		"link": "https://www.olx.ua/obyavlenie/ukranska-shveytsarya-uchastok-dacha-tripllya-s-halepya-IDEeNPF.html#f7065a9d45",
			"Объявление от": "Бизнес",
			"Выберите рубрику": "Продажа домов",
			"Без комиссии": "",
			"Возможность обмена": "",
			"Готов сотрудничать с риэлторами": "",
			"Этажность": "2",
			"Общая площадь": "100 м²",
			"Количество комнат": "3",
			"Площадь участка": "10 соток",
			"Тип дома": "Дом",
			"price": "30 000 $",
			"description": "Объявление от    Бизнес         Выберите рубрику    Продажа домов           Без комиссии             Возможность обмена               Готов сотрудничать с риэлторами             Этажность   2          Общая площадь   100 м²        Количество комнат   3          Площадь участка   10 соток        Тип дома    Дом                                                                                          Станція метро ВИДУБИЧІ - 45 км.; маршрутки до Украінки і Києва; 3 магазини  (пішки); багото озер, р.Дніпро - 800 метрів. «Українська Швейцарія» - та часто називають цю живописну місцевість місцеві жителі та гості. А ще- цей чистий куточок природи один з небагатьох, які не ввійшли в карту забруднених районів після Чорнобиля. Саме тому відомі фітотерапевти Зубицькі тут вирощували свої цілющі трави.Чудові краєвиди, родючий пухкий ґрунт, 2 озера на відстані 1 км, сад плодових дерев, кущі смородини і малини, винорадник, кіпарисова зона, квітник троянд, тюльпанів, лілей, ірисів, гортензіі На ділянці 10 соток є двоповерховий утеплений цегляний будинок. Всередині кімната-вітальня, спальня або дитяча кімната на 2-му поверсі; кухня, сільська робоча грубка, обладнана душова кабіна, туалет, оглядова лоджія, велика закрита сточна яма, централізоване підсведення води та електрики, яка замінює камин і якою можна обігрівати весь будинок, а також є для опалення вмонтовані електробатареї. Система каналізації, 2 криниці та електронасос. Євро вікна з потрійним склопакетом, ролети та москитні сітки. Прокладена дорога, місце для стоянки. При будинку є великий сарай, який при бажанні легко можна переобладнати в сауну із зоною відпочинку. Також є чудова простора веранда, надійно закрита від дощів, вітру та спеки. Це гарне місце для денного відпочинку на шезлонгах та обіду за великим столом. Під будинком є великий підвал для зберігання консервації, додаткова яма для зберігання картоплі. На ділянці є дві криниці із смачною водою, насосна станція подає воду в житловий будинок. По території спеціально викладені доріжки та побудовані клумби для квітників. Металева огорожа на високих гранітних мурах. Ділянка обладнана системою поливу. Також є другий літній будиночок для гостей із кухнею, грубою та сараєм з підвалом. Дача на бугрі в ложбинці, куди не задуває сніг та вітри. Ціна 30000 у.е. ТОРГУЄМОСЯ! Можливий викуп 20 соток землі під забудову , 2 км. від дачі, за окрему ціну.",
			"images": 5,
			"location": "Триполье, Киевская область, Обуховский район\n                        \n                            Показать на карте"
	},
	"https://www.olx.ua/obyavlenie/prodam-kirpichnyy-dom-v-s-voronkov-70-m-kv-s-kommunikatsiyami-i-baney-IDD2A0q.html#f7065a9d45": {
		"link": "https://www.olx.ua/obyavlenie/prodam-kirpichnyy-dom-v-s-voronkov-70-m-kv-s-kommunikatsiyami-i-baney-IDD2A0q.html#f7065a9d45",
			"Объявление от": "Частного лица",
			"Выберите рубрику": "Продажа домов",
			"Без комиссии": "",
			"Возможность обмена": "",
			"Готов сотрудничать с риэлторами": "",
			"Этажность": "1",
			"Общая площадь": "70 м²",
			"Количество комнат": "4",
			"Площадь участка": "25 соток",
			"Тип дома": "Дом",
			"Тип стен": "Кирпичный",
			"Тип кровли": "Шифер",
			"Санузел": "Смежный",
			"Отопление": "Комбинированное",
			"Ремонт": "Жилое состояние",
			"Меблирование": "Да",
			"Бытовая техника": "Холодильник\n\nМикроволновая печь\n\nПлита\n\nСтиральная машина",
			"Коммуникации": "Асфальтированная дорога\n\nЭлектричество\n\nВывоз отходов\n\nГаз\n\nСкважина",
			"price": "26 000 $",
			"description": "Объявление от    Частного лица         Выберите рубрику    Продажа домов           Без комиссии             Возможность обмена               Готов сотрудничать с риэлторами             Этажность   1          Общая площадь   70 м²        Количество комнат   4          Площадь участка   25 соток        Тип дома    Дом           Тип стен    Кирпичный         Тип кровли    Шифер           Санузел    Смежный         Отопление    Комбинированное           Ремонт    Жилое состояние         Меблирование    Да           Бытовая техника    Холодильник  Микроволновая печь  Плита  Стиральная машина         Коммуникации    Асфальтированная дорога  Электричество  Вывоз отходов  Газ  Скважина                                                                                          35 км от КП, центр села, добротный кирпичный дом 70 кв.м,  состояние хорошее, все коммуникации в доме, отопление газовое и дровяное, стеклопакеты, ремонт, возможно с мебелью. Асфальтированный подъезд, с хозяйством, на участке 25 соток есть русская банька, погреб, теплицы, ухоженный небольшой сад.   Можно въехать и жить поживать.",
			"images": 5,
			"location": "Воронков, Киевская область, Бориспольский район\n                        \n                            Показать на карте"
	},
	"https://www.olx.ua/obyavlenie/svoy-dom-po-tsene-kvartiry-irpen-IDExfWn.html#f7065a9d45": {
		"link": "https://www.olx.ua/obyavlenie/svoy-dom-po-tsene-kvartiry-irpen-IDExfWn.html#f7065a9d45",
			"Объявление от": "Бизнес",
			"Выберите рубрику": "Продажа домов",
			"Без комиссии": "Без комиссии",
			"Этажность": "2",
			"Общая площадь": "120 м²",
			"Количество комнат": "4",
			"Площадь участка": "400 соток",
			"Тип дома": "Дом",
			"Год постройки / сдачи": "Не этапе строительства",
			"Комфорт": "Ванна",
			"price": "55 000 $",
			"description": "Объявление от    Бизнес         Выберите рубрику    Продажа домов           Без комиссии    Без комиссии         Этажность   2          Общая площадь   120 м²        Количество комнат   4          Площадь участка   400 соток        Тип дома    Дом           Год постройки / сдачи    Не этапе строительства         Комфорт    Ванна                                                                                          Свой качественный кирпичный дом на 4х сотках. Удобное место для комфортной жизни всего 7 км. от Киева.   Дом в новом современном коттеджном  городке.  Участок: 4  сотки (приватизированы) Характеристики дома:      Материал постройки: кирпич  + утеплитель пенопласт + короед;     Крыша: металлочерепица;     Окна:  2-х камерные  стеклопакеты;     Пол: без стяжки;     С/у: 2, раздельные      Отопление: газовое, (2-х контурный котел без установки радиаторов)     Электрика: ввод в дом до распределительного короба.     Коммуникации: свет, газ, вода (скважина), выгребная яма.     Состояние дома: после строителей Дополнительно: В доме на 1-м этаже кухня-студия, коридор, санузел, спальня, на 2-м этаже: 3 спальни санузел и гардероб, бетонная лестница, навес для автомобиля. Инфраструктура: Удобная инфраструктура. Рядом остановка маршрутного такси, продуктовый магазин. До Киева 7 км по новой трассе до  ст. Метро Академгородок.  Прямая продажа! Минимальные затраты при оформлении! Подробно звоните прямо сейчас с ув. Галина.    Компанія: АН Партнер",
			"images": 5,
			"location": "Ирпень, Киевская область                            Посмотреть на карте"
	},
	"https://www.olx.ua/obyavlenie/prodam-uchastok-v-stoyanke-12-sotok-dom-gaz-elektr-skvazhina-IDC3Enl.html#f7065a9d45": {
		"link": "https://www.olx.ua/obyavlenie/prodam-uchastok-v-stoyanke-12-sotok-dom-gaz-elektr-skvazhina-IDC3Enl.html#f7065a9d45",
			"Объявление от": "Частного лица",
			"Выберите рубрику": "Продажа домов",
			"Без комиссии": "Без комиссии",
			"Расстояние до ближайшего города": "до 5 км.",
			"Этажность": "2.50",
			"Общая площадь": "100 м²",
			"Количество комнат": "3",
			"Площадь участка": "12 соток",
			"Тип дома": "Дача",
			"Тип кровли": "Шифер",
			"Коммуникации": "Электричество\n\nГаз\n\nСкважина",
			"Ландшафт (до 1 км.)": "Лес\n\nРека",
			"price": "40 000 $",
			"description": "Объявление от    Частного лица         Выберите рубрику    Продажа домов           Без комиссии    Без комиссии         Расстояние до ближайшего города    до 5 км.           Этажность   2.50        Общая площадь   100 м²          Количество комнат   3        Площадь участка   12 соток          Тип дома    Дача         Тип кровли    Шифер           Коммуникации    Электричество  Газ  Скважина         Ландшафт (до 1 км.)    Лес  Река                                                                                          12 соток + дом (коробка + крыша) газ / электричество / скважина 16м  Удобная транспортная развязка, хорошие соседи, центр города Ирпень в 4 км, 15км до м. Святошено, проведен интернет кабель (оптоволокно)",
			"images": 5,
			"location": "Стоянка, Киевская область, Киево-Святошинский район\n                        \n                            Показать на карте"
	},
	"https://www.olx.ua/obyavlenie/prodam-uchastok-v-stoyanke-12-sotok-dom-gaz-elektr-skvazhina-IDC3Enl.html#f7065a9d45;promoted": {
		"link": "https://www.olx.ua/obyavlenie/prodam-uchastok-v-stoyanke-12-sotok-dom-gaz-elektr-skvazhina-IDC3Enl.html#f7065a9d45;promoted",
			"Объявление от": "Частного лица",
			"Выберите рубрику": "Продажа домов",
			"Без комиссии": "Без комиссии",
			"Расстояние до ближайшего города": "до 5 км.",
			"Этажность": "2.50",
			"Общая площадь": "100 м²",
			"Количество комнат": "3",
			"Площадь участка": "12 соток",
			"Тип дома": "Дача",
			"Тип кровли": "Шифер",
			"Коммуникации": "Электричество\n\nГаз\n\nСкважина",
			"Ландшафт (до 1 км.)": "Лес\n\nРека",
			"price": "40 000 $",
			"description": "Объявление от    Частного лица         Выберите рубрику    Продажа домов           Без комиссии    Без комиссии         Расстояние до ближайшего города    до 5 км.           Этажность   2.50        Общая площадь   100 м²          Количество комнат   3        Площадь участка   12 соток          Тип дома    Дача         Тип кровли    Шифер           Коммуникации    Электричество  Газ  Скважина         Ландшафт (до 1 км.)    Лес  Река                                                                                          12 соток + дом (коробка + крыша) газ / электричество / скважина 16м  Удобная транспортная развязка, хорошие соседи, центр города Ирпень в 4 км, 15км до м. Святошено, проведен интернет кабель (оптоволокно)",
			"images": 5,
			"location": "Стоянка, Киевская область, Киево-Святошинский район\n                        \n                            Показать на карте"
	},
	"https://www.olx.ua/obyavlenie/prodazha-zhilogo-doma-rozhny-ot-sobstvennika-IDAwp7O.html#f7065a9d45": {
		"link": "https://www.olx.ua/obyavlenie/prodazha-zhilogo-doma-rozhny-ot-sobstvennika-IDAwp7O.html#f7065a9d45",
			"Объявление от": "Частного лица",
			"Выберите рубрику": "Продажа домов",
			"Без комиссии": "Без комиссии",
			"Возможность обмена": "",
			"Готов сотрудничать с риэлторами": "Готов сотрудничать с риэлторами",
			"Расстояние до ближайшего города": "до 20 км.",
			"Этажность": "2",
			"Общая площадь": "125 м²",
			"Количество комнат": "5",
			"Площадь участка": "23 соток",
			"Тип дома": "Дом",
			"Кадастровый номер": "3221287201:01:072:0016",
			"Год постройки / сдачи": "1980 - 1989",
			"Тип стен": "Кирпичный",
			"Тип кровли": "Шифер",
			"Санузел": "Смежный",
			"Отопление": "Комбинированное",
			"Ремонт": "Жилое состояние",
			"Мультимедиа": "Спутниковое ТВ\n\nСкоростной интернет",
			"Комфорт": "Кондиционер\n\nВанна\n\nГараж\n\nСад",
			"Коммуникации": "Электричество\n\nГаз\n\nКанализация септик\n\nСкважина",
			"Инфраструктура (до 500 метров)": "Магазин\n\nкиоск",
			"Ландшафт (до 1 км.)": "Лес\n\nОзеро\n\nРека",
			"price": "36 000 $ Договорная",
			"description": "Объявление от    Частного лица         Выберите рубрику    Продажа домов           Без комиссии    Без комиссии         Возможность обмена               Готов сотрудничать с риэлторами    Готов сотрудничать с риэлторами         Расстояние до ближайшего города    до 20 км.           Этажность   2        Общая площадь   125 м²          Количество комнат   5        Площадь участка   23 соток          Тип дома    Дом         Кадастровый номер   3221287201:01:072:0016           Год постройки / сдачи    1980 - 1989         Тип стен    Кирпичный           Тип кровли    Шифер         Санузел    Смежный           Отопление    Комбинированное         Ремонт    Жилое состояние           Мультимедиа    Спутниковое ТВ  Скоростной интернет         Комфорт    Кондиционер  Ванна  Гараж  Сад           Коммуникации    Электричество  Газ  Канализация септик  Скважина         Инфраструктура (до 500 метров)    Магазин  киоск           Ландшафт (до 1 км.)    Лес  Озеро  Река                                                                                            Продам дом в с. Рожны Броварского района. Общая площадь 125 кв.м. Жилая  -52 кв.м на первом этаже:3 комнаты, кухня, 2 веранды, ванная, кладовая. На втором этаже 32 кв.м -.2 комнаты после строителей. Жилое состояние. В двух комнатах косметический ремонт и металлопластиковые окна. .Газовое отопление Есть твердотопливный котел и печь. Два отдельных входа. Удобства и вода в доме В одной веранде погреб. На участке есть гараж, кирпичный сарай, погреб, скважина. До Десны 15 минут ходьбы, до леса 10 минут. Магазин, остановка транспорта рядом.",
			"images": 5,
			"location": "Рожны, Киевская область, Броварской район\n                        \n                            Показать на карте"
	},
	"https://www.olx.ua/obyavlenie/prodam-dom-kievskaya-oblast-velikaya-dymerka-IDEkNeu.html#f7065a9d45": {
		"link": "https://www.olx.ua/obyavlenie/prodam-dom-kievskaya-oblast-velikaya-dymerka-IDEkNeu.html#f7065a9d45",
			"Объявление от": "Бизнес",
			"Выберите рубрику": "Продажа домов",
			"Без комиссии": "Без комиссии",
			"Возможность обмена": "Возможность обмена",
			"Готов сотрудничать с риэлторами": "Готов сотрудничать с риэлторами",
			"Расстояние до ближайшего города": "до 20 км.",
			"Этажность": "1",
			"Общая площадь": "120 м²",
			"Количество комнат": "5",
			"Площадь участка": "43 соток",
			"Тип дома": "Дом",
			"Тип стен": "Кирпичный",
			"price": "45 000 $",
			"description": "Объявление от    Бизнес         Выберите рубрику    Продажа домов           Без комиссии    Без комиссии         Возможность обмена    Возможность обмена           Готов сотрудничать с риэлторами    Готов сотрудничать с риэлторами         Расстояние до ближайшего города    до 20 км.           Этажность   1        Общая площадь   120 м²          Количество комнат   5        Площадь участка   43 соток          Тип дома    Дом         Тип стен    Кирпичный                                                                                          Великая Дымерка Площадь дома 150 м² Земля 43 сотки Цена 50 000 $  В доме есть все коммуникации, своя скважина. На участке есть теплицы. Продаем с мебелью.    От Киева 27 км — это ~30 минут машиной. Также от остановки Быковня-1 регулярно ходят маршрутки №709 и №705. До остановки от метро Лесная идти 15 минут или можно подъехать маршруткой.   В округе несколько озер, зеленые зоны. А в 5 км есть национальный природный заповедник Залесье — там много красивых и диких мест, где приятно отдохнуть с семьей, порыбачить на Десне и полюбоваться видами.",
			"images": 5,
			"location": "Большая Дымерка, Киевская область, Броварской район\n                        \n                            Показать на карте"
	},
	"https://www.olx.ua/obyavlenie/prodam-dom-kievskaya-oblast-velikaya-dymerka-IDEkNeu.html#f7065a9d45;promoted": {
		"link": "https://www.olx.ua/obyavlenie/prodam-dom-kievskaya-oblast-velikaya-dymerka-IDEkNeu.html#f7065a9d45;promoted",
			"Объявление от": "Бизнес",
			"Выберите рубрику": "Продажа домов",
			"Без комиссии": "Без комиссии",
			"Возможность обмена": "Возможность обмена",
			"Готов сотрудничать с риэлторами": "Готов сотрудничать с риэлторами",
			"Расстояние до ближайшего города": "до 20 км.",
			"Этажность": "1",
			"Общая площадь": "120 м²",
			"Количество комнат": "5",
			"Площадь участка": "43 соток",
			"Тип дома": "Дом",
			"Тип стен": "Кирпичный",
			"price": "45 000 $",
			"description": "Объявление от    Бизнес         Выберите рубрику    Продажа домов           Без комиссии    Без комиссии         Возможность обмена    Возможность обмена           Готов сотрудничать с риэлторами    Готов сотрудничать с риэлторами         Расстояние до ближайшего города    до 20 км.           Этажность   1        Общая площадь   120 м²          Количество комнат   5        Площадь участка   43 соток          Тип дома    Дом         Тип стен    Кирпичный                                                                                          Великая Дымерка Площадь дома 150 м² Земля 43 сотки Цена 50 000 $  В доме есть все коммуникации, своя скважина. На участке есть теплицы. Продаем с мебелью.    От Киева 27 км — это ~30 минут машиной. Также от остановки Быковня-1 регулярно ходят маршрутки №709 и №705. До остановки от метро Лесная идти 15 минут или можно подъехать маршруткой.   В округе несколько озер, зеленые зоны. А в 5 км есть национальный природный заповедник Залесье — там много красивых и диких мест, где приятно отдохнуть с семьей, порыбачить на Десне и полюбоваться видами.",
			"images": 5,
			"location": "Большая Дымерка, Киевская область, Броварской район\n                        \n                            Показать на карте"
	},
	"https://www.olx.ua/obyavlenie/s-rozhny-dom-2-etazha-25km-ot-kieva-zona-otdyha-dlya-dushi-torg-IDCeiK3.html#f7065a9d45": {
		"link": "https://www.olx.ua/obyavlenie/s-rozhny-dom-2-etazha-25km-ot-kieva-zona-otdyha-dlya-dushi-torg-IDCeiK3.html#f7065a9d45",
			"Объявление от": "Бизнес",
			"Выберите рубрику": "Продажа домов",
			"Без комиссии": "Без комиссии",
			"Готов сотрудничать с риэлторами": "Готов сотрудничать с риэлторами",
			"Расстояние до ближайшего города": "до 20 км.",
			"Этажность": "2",
			"Общая площадь": "227 м²",
			"Количество комнат": "5",
			"Площадь участка": "50 соток",
			"Тип дома": "Дом",
			"Год постройки / сдачи": "2011 - 2015",
			"Тип стен": "Монолитный",
			"Тип кровли": "Металлочерепица",
			"Санузел": "Раздельный",
			"Отопление": "Индивидуальное газовое",
			"Ремонт": "Под чистовую отделку",
			"Коммуникации": "Газ\n\nСкважина\n\nЭлектричество\n\nАсфальтированная дорога",
			"Инфраструктура (до 500 метров)": "Остановка транспорта\n\nМагазин\n\nкиоск",
			"Ландшафт (до 1 км.)": "Река\n\nЛес",
			"price": "53 000 $",
			"description": "Объявление от    Бизнес         Выберите рубрику    Продажа домов           Без комиссии    Без комиссии         Готов сотрудничать с риэлторами    Готов сотрудничать с риэлторами           Расстояние до ближайшего города    до 20 км.         Этажность   2          Общая площадь   227 м²        Количество комнат   5          Площадь участка   50 соток        Тип дома    Дом           Год постройки / сдачи    2011 - 2015         Тип стен    Монолитный           Тип кровли    Металлочерепица         Санузел    Раздельный           Отопление    Индивидуальное газовое         Ремонт    Под чистовую отделку           Коммуникации    Газ  Скважина  Электричество  Асфальтированная дорога         Инфраструктура (до 500 метров)    Остановка транспорта  Магазин  киоск           Ландшафт (до 1 км.)    Река  Лес                                                                                            Броварской район.С.Рожны, 25 км от Киева.Центр села.Дом в 2 этажа , пенобетон, утепление, внешняя отделка общ.пл 227метров.Возможна любая перепланировка. внутри дома.Второй этаж-каминный зал + 2 комнаты . Крыша металлочерепица,вывод под камин, газ, теплые полы ..Установлен газовый котел, электричество, канализация, скважина.С/узел в доме., гараж на 3 машины.Кухня расположена рядом с домом , отдельностоящая постройка 27 метров с камином/по типу калыбы/ , погреб, окна м.п.о..Во дворе шикарная баня из карпатского сруба/ привезен из Закарпатья/ в 2 этажа площадью 58 метров.Участок 28 соток правильной. формы.шикарная зона для жилья или загородного комплекса для отдыха .Цена 53000долларов США, без комиссии. РАССМОТРИМ ВАШИ ПРЕДЛОЖЕНИЯ Реальному покупателю хорошая скидка..тел. 980 - Показать номер - ,  504 - Показать номер -",
			"images": 5,
			"location": "Рожны, Киевская область, Броварской район\n                        \n                            Показать на карте"
	},
	"https://www.olx.ua/obyavlenie/s-rozhny-dom-2-etazha-25km-ot-kieva-zona-otdyha-dlya-dushi-torg-IDCeiK3.html#f7065a9d45;promoted": {
		"link": "https://www.olx.ua/obyavlenie/s-rozhny-dom-2-etazha-25km-ot-kieva-zona-otdyha-dlya-dushi-torg-IDCeiK3.html#f7065a9d45;promoted",
			"Объявление от": "Бизнес",
			"Выберите рубрику": "Продажа домов",
			"Без комиссии": "Без комиссии",
			"Готов сотрудничать с риэлторами": "Готов сотрудничать с риэлторами",
			"Расстояние до ближайшего города": "до 20 км.",
			"Этажность": "2",
			"Общая площадь": "227 м²",
			"Количество комнат": "5",
			"Площадь участка": "50 соток",
			"Тип дома": "Дом",
			"Год постройки / сдачи": "2011 - 2015",
			"Тип стен": "Монолитный",
			"Тип кровли": "Металлочерепица",
			"Санузел": "Раздельный",
			"Отопление": "Индивидуальное газовое",
			"Ремонт": "Под чистовую отделку",
			"Коммуникации": "Газ\n\nСкважина\n\nЭлектричество\n\nАсфальтированная дорога",
			"Инфраструктура (до 500 метров)": "Остановка транспорта\n\nМагазин\n\nкиоск",
			"Ландшафт (до 1 км.)": "Река\n\nЛес",
			"price": "53 000 $",
			"description": "Объявление от    Бизнес         Выберите рубрику    Продажа домов           Без комиссии    Без комиссии         Готов сотрудничать с риэлторами    Готов сотрудничать с риэлторами           Расстояние до ближайшего города    до 20 км.         Этажность   2          Общая площадь   227 м²        Количество комнат   5          Площадь участка   50 соток        Тип дома    Дом           Год постройки / сдачи    2011 - 2015         Тип стен    Монолитный           Тип кровли    Металлочерепица         Санузел    Раздельный           Отопление    Индивидуальное газовое         Ремонт    Под чистовую отделку           Коммуникации    Газ  Скважина  Электричество  Асфальтированная дорога         Инфраструктура (до 500 метров)    Остановка транспорта  Магазин  киоск           Ландшафт (до 1 км.)    Река  Лес                                                                                            Броварской район.С.Рожны, 25 км от Киева.Центр села.Дом в 2 этажа , пенобетон, утепление, внешняя отделка общ.пл 227метров.Возможна любая перепланировка. внутри дома.Второй этаж-каминный зал + 2 комнаты . Крыша металлочерепица,вывод под камин, газ, теплые полы ..Установлен газовый котел, электричество, канализация, скважина.С/узел в доме., гараж на 3 машины.Кухня расположена рядом с домом , отдельностоящая постройка 27 метров с камином/по типу калыбы/ , погреб, окна м.п.о..Во дворе шикарная баня из карпатского сруба/ привезен из Закарпатья/ в 2 этажа площадью 58 метров.Участок 28 соток правильной. формы.шикарная зона для жилья или загородного комплекса для отдыха .Цена 53000долларов США, без комиссии. РАССМОТРИМ ВАШИ ПРЕДЛОЖЕНИЯ Реальному покупателю хорошая скидка..тел. 980 - Показать номер - ,  504 - Показать номер -",
			"images": 5,
			"location": "Рожны, Киевская область, Броварской район\n                        \n                            Показать на карте"
	},
	"https://www.olx.ua/obyavlenie/dom-po-tsene-dvushki-pod-kievom-10-sotok-IDBBlWm.html#f7065a9d45": {
		"link": "https://www.olx.ua/obyavlenie/dom-po-tsene-dvushki-pod-kievom-10-sotok-IDBBlWm.html#f7065a9d45",
			"Объявление от": "Частного лица",
			"Выберите рубрику": "Продажа домов",
			"Без комиссии": "Без комиссии",
			"Возможность обмена": "Возможность обмена",
			"Готов сотрудничать с риэлторами": "Готов сотрудничать с риэлторами",
			"Расстояние до ближайшего города": "до 20 км.",
			"Этажность": "2",
			"Общая площадь": "170 м²",
			"Количество комнат": "5",
			"Площадь участка": "10 соток",
			"Тип дома": "Дом",
			"Год постройки / сдачи": "2011 - 2015",
			"Тип стен": "Газоблок",
			"Внешнее утепление стен": "Пенопласт",
			"Тип кровли": "Металлочерепица",
			"Отопление": "Индивидуальное электро",
			"Ремонт": "Авторский проект",
			"Меблирование": "Да",
			"Бытовая техника": "Холодильник\n\nВарочная панель\n\nМикроволновая печь\n\nДуховой шкаф\n\nПлита\n\nСтиральная машина",
			"Мультимедиа": "Кабельное\n\nцифровое ТВ\n\nСпутниковое ТВ\n\nСкоростной интернет",
			"Комфорт": "Автоматические ворота\n\nВанна\n\nЗабор\n\nограждение\n\nГараж\n\nСад\n\nогород\n\nПодогрев пола",
			"Коммуникации": "Асфальтированная дорога\n\nЭлектричество\n\nВывоз отходов\n\nКанализация септик\n\nСкважина",
			"Инфраструктура (до 500 метров)": "Аптека\n\nБольница\n\nполиклиника\n\nДетский сад\n\nРынок\n\nПарк\n\nзелёная зона\n\nДетская площадка\n\nОтделение почты\n\nШкола",
			"Ландшафт (до 1 км.)": "Лес\n\nОзеро\n\nРека",
			"price": "59 000 $ Договорная",
			"description": "Объявление от    Частного лица         Выберите рубрику    Продажа домов           Без комиссии    Без комиссии         Возможность обмена    Возможность обмена           Готов сотрудничать с риэлторами    Готов сотрудничать с риэлторами         Расстояние до ближайшего города    до 20 км.           Этажность   2        Общая площадь   170 м²          Количество комнат   5        Площадь участка   10 соток          Тип дома    Дом         Год постройки / сдачи    2011 - 2015           Тип стен    Газоблок         Внешнее утепление стен    Пенопласт           Тип кровли    Металлочерепица         Отопление    Индивидуальное электро           Ремонт    Авторский проект         Меблирование    Да           Бытовая техника    Холодильник  Варочная панель  Микроволновая печь  Духовой шкаф  Плита  Стиральная машина         Мультимедиа    Кабельное  цифровое ТВ  Спутниковое ТВ  Скоростной интернет           Комфорт    Автоматические ворота  Ванна  Забор  ограждение  Гараж  Сад  огород  Подогрев пола         Коммуникации    Асфальтированная дорога  Электричество  Вывоз отходов  Канализация септик  Скважина           Инфраструктура (до 500 метров)    Аптека  Больница  поликлиника  Детский сад  Рынок  Парк  зелёная зона  Детская площадка  Отделение почты  Школа         Ландшафт (до 1 км.)    Лес  Озеро  Река                                                                                          Прекрасный дом с евроремонтом расположенный в первой линии частного сектора, п. Ревное, Бориспольский район. Рядом с домом детский садик, школа посёлок имеет развитую торговую сеть и услуги.   Асфальтированный проезд.Расстояние от  КП Киев к дому 20 км, от Борисполя 12км.  Удобное транспортное сообщение. На Киев маршрутки каждые 20 мин.  В доме 5 комнат,  большая кухня студия и 2 санузла.  Свежий ремонт. Теплый пол.  Есть выход на терасу  и гараж с дома.  кабельный интернет, спутниковое ТВ. Очень выгодный коммунальный тариф, дешевле чем в квартире в Киеве. До остановки общественного транспорта 10 минут пешком. Маршрутки на Киев каждіе 20 минут. Большой двор.   Молодой сад. Все документы оформлены. В доме можно прописаться.  Более подробно звоните пишите, отвечу на любые вопросы,  Хозяин. Не риэлтор.",
			"images": 5,
			"location": "Ревное, Киевская область, Бориспольский район\n                        \n                            Показать на карте"
	},
	"https://www.olx.ua/obyavlenie/dom-po-tsene-dvushki-pod-kievom-10-sotok-IDBBlWm.html#f7065a9d45;promoted": {
		"link": "https://www.olx.ua/obyavlenie/dom-po-tsene-dvushki-pod-kievom-10-sotok-IDBBlWm.html#f7065a9d45;promoted",
			"Объявление от": "Частного лица",
			"Выберите рубрику": "Продажа домов",
			"Без комиссии": "Без комиссии",
			"Возможность обмена": "Возможность обмена",
			"Готов сотрудничать с риэлторами": "Готов сотрудничать с риэлторами",
			"Расстояние до ближайшего города": "до 20 км.",
			"Этажность": "2",
			"Общая площадь": "170 м²",
			"Количество комнат": "5",
			"Площадь участка": "10 соток",
			"Тип дома": "Дом",
			"Год постройки / сдачи": "2011 - 2015",
			"Тип стен": "Газоблок",
			"Внешнее утепление стен": "Пенопласт",
			"Тип кровли": "Металлочерепица",
			"Отопление": "Индивидуальное электро",
			"Ремонт": "Авторский проект",
			"Меблирование": "Да",
			"Бытовая техника": "Холодильник\n\nВарочная панель\n\nМикроволновая печь\n\nДуховой шкаф\n\nПлита\n\nСтиральная машина",
			"Мультимедиа": "Кабельное\n\nцифровое ТВ\n\nСпутниковое ТВ\n\nСкоростной интернет",
			"Комфорт": "Автоматические ворота\n\nВанна\n\nЗабор\n\nограждение\n\nГараж\n\nСад\n\nогород\n\nПодогрев пола",
			"Коммуникации": "Асфальтированная дорога\n\nЭлектричество\n\nВывоз отходов\n\nКанализация септик\n\nСкважина",
			"Инфраструктура (до 500 метров)": "Аптека\n\nБольница\n\nполиклиника\n\nДетский сад\n\nРынок\n\nПарк\n\nзелёная зона\n\nДетская площадка\n\nОтделение почты\n\nШкола",
			"Ландшафт (до 1 км.)": "Лес\n\nОзеро\n\nРека",
			"price": "59 000 $ Договорная",
			"description": "Объявление от    Частного лица         Выберите рубрику    Продажа домов           Без комиссии    Без комиссии         Возможность обмена    Возможность обмена           Готов сотрудничать с риэлторами    Готов сотрудничать с риэлторами         Расстояние до ближайшего города    до 20 км.           Этажность   2        Общая площадь   170 м²          Количество комнат   5        Площадь участка   10 соток          Тип дома    Дом         Год постройки / сдачи    2011 - 2015           Тип стен    Газоблок         Внешнее утепление стен    Пенопласт           Тип кровли    Металлочерепица         Отопление    Индивидуальное электро           Ремонт    Авторский проект         Меблирование    Да           Бытовая техника    Холодильник  Варочная панель  Микроволновая печь  Духовой шкаф  Плита  Стиральная машина         Мультимедиа    Кабельное  цифровое ТВ  Спутниковое ТВ  Скоростной интернет           Комфорт    Автоматические ворота  Ванна  Забор  ограждение  Гараж  Сад  огород  Подогрев пола         Коммуникации    Асфальтированная дорога  Электричество  Вывоз отходов  Канализация септик  Скважина           Инфраструктура (до 500 метров)    Аптека  Больница  поликлиника  Детский сад  Рынок  Парк  зелёная зона  Детская площадка  Отделение почты  Школа         Ландшафт (до 1 км.)    Лес  Озеро  Река                                                                                          Прекрасный дом с евроремонтом расположенный в первой линии частного сектора, п. Ревное, Бориспольский район. Рядом с домом детский садик, школа посёлок имеет развитую торговую сеть и услуги.   Асфальтированный проезд.Расстояние от  КП Киев к дому 20 км, от Борисполя 12км.  Удобное транспортное сообщение. На Киев маршрутки каждые 20 мин.  В доме 5 комнат,  большая кухня студия и 2 санузла.  Свежий ремонт. Теплый пол.  Есть выход на терасу  и гараж с дома.  кабельный интернет, спутниковое ТВ. Очень выгодный коммунальный тариф, дешевле чем в квартире в Киеве. До остановки общественного транспорта 10 минут пешком. Маршрутки на Киев каждіе 20 минут. Большой двор.   Молодой сад. Все документы оформлены. В доме можно прописаться.  Более подробно звоните пишите, отвечу на любые вопросы,  Хозяин. Не риэлтор.",
			"images": 5,
			"location": "Ревное, Киевская область, Бориспольский район\n                        \n                            Показать на карте"
	},
	"https://www.olx.ua/obyavlenie/srochno-prodam-ne-dostroennyy-dom-IDEx8Bt.html#f7065a9d45": {
		"link": "https://www.olx.ua/obyavlenie/srochno-prodam-ne-dostroennyy-dom-IDEx8Bt.html#f7065a9d45",
			"Объявление от": "Частного лица",
			"Выберите рубрику": "Продажа домов",
			"Возможность обмена": "Возможность обмена",
			"Готов сотрудничать с риэлторами": "Готов сотрудничать с риэлторами",
			"Расстояние до ближайшего города": "до 40 км.",
			"Этажность": "2",
			"Общая площадь": "218 м²",
			"Количество комнат": "6",
			"Площадь участка": "25 соток",
			"Тип дома": "Дом",
			"Год постройки / сдачи": "Не этапе строительства",
			"price": "300 000 грн. Договорная",
			"description": "Объявление от    Частного лица         Выберите рубрику    Продажа домов           Возможность обмена    Возможность обмена         Готов сотрудничать с риэлторами    Готов сотрудничать с риэлторами           Расстояние до ближайшего города    до 40 км.         Этажность   2          Общая площадь   218 м²        Количество комнат   6          Площадь участка   25 соток        Тип дома    Дом           Год постройки / сдачи    Не этапе строительства                                                                                            Срочно продам не достроенный ⁸дом.  Дом находится в пгт.Бышев, Макаровского района. В населеном пункте есть больница, школа, садик, полиция, сельсовет, магазины, часто ходит транспорт на Киев. От Борщаговки до Бышева 40 км. земля приватизирована и есть разрешение на постройку дома. Правда официально зарегистрирован другой проэкт.       Дом находится на поле. С одной стороны улицы жилые дома, а с другой стороны улицы поле, паи которые роздали жильцам Бышива. есть скважина 56 метров глубиной, первый этаж выгнан полностью, перекрытие между этажами есть (плиты), второй этаж мансарда - крыши нет.      участок 25 соток, в доме два входа, центральный и с кухни. планировали пристроить беседку в будущем саду. на первом этаже, по проэкту, зал, две спальни, кухня и душевая с туалетом. На втором этаже 3 спальни с гардеробными и ванна с туалетом.      Мои контакты -  673 - Показать номер -  или  955 - Показать номер -  Наталья. Торг уместен",
			"images": 5,
			"location": "Киев, Киевская область, Дарницкий\n                        \n                            Показать на карте"
	},
	"https://www.olx.ua/obyavlenie/prodam-dom-marhalevka-ivankovichi-IDsbue6.html#f7065a9d45": {
		"link": "https://www.olx.ua/obyavlenie/prodam-dom-marhalevka-ivankovichi-IDsbue6.html#f7065a9d45",
			"Объявление от": "Частного лица",
			"Выберите рубрику": "Продажа домов",
			"Этажность": "2",
			"Общая площадь": "70 м²",
			"Количество комнат": "3",
			"Площадь участка": "10 соток",
			"Тип дома": "Дом",
			"Тип кровли": "Металлочерепица",
			"Санузел": "Во дворе",
			"Отопление": "Комбинированное",
			"Мультимедиа": "Спутниковое ТВ",
			"Ландшафт (до 1 км.)": "Лес\n\nОзеро",
			"price": "32 000 $",
			"description": "Объявление от    Частного лица         Выберите рубрику    Продажа домов           Этажность   2        Общая площадь   70 м²          Количество комнат   3        Площадь участка   10 соток          Тип дома    Дом         Тип кровли    Металлочерепица           Санузел    Во дворе         Отопление    Комбинированное           Мультимедиа    Спутниковое ТВ         Ландшафт (до 1 км.)    Лес  Озеро                                                                                          #Продам свою дом/дачу в кооперативе \"Дорожник\" между с.Иванковичи и с. Мархаливка по Одесской трассе в 15 км от Киева. Находится в сосновом лесу, рядом с домом озеро:) Добротный двухэтажный кирпичный дом около 70кв. метров, три комнаты (гостиная 25кв.м. с действующим камином!), мансардный этаж, веранда метров 30 :) Отопление печное + камин, металлопластиковые окна, вода заведена в дом, насосная станция, газ по улице, санузел и душ в отдельном кирпичном строении, крыша металлочерепица  Участок 6 соток + возможность бесплатно приватизировать еще 5 соток:) На участке много плодоносящих фруктовых деревьев и кустов, виноград и клубника:) Большая кирпичная беседка 30кв.м.  Возможен обмен на квартиру:) Собственник  505 - Показать номер -",
			"images": 5,
			"location": "Мархаловка, Киевская область, Васильковский район\n                        \n                            Показать на карте"
	},
	"https://www.olx.ua/obyavlenie/prodatsya-budinok-smt-velika-dimerka-brovarskiy-r-n-IDkJHLK.html#f7065a9d45": {
		"link": "https://www.olx.ua/obyavlenie/prodatsya-budinok-smt-velika-dimerka-brovarskiy-r-n-IDkJHLK.html#f7065a9d45",
			"Объявление от": "Частного лица",
			"Выберите рубрику": "Продажа домов",
			"Без комиссии": "Без комиссии",
			"Расстояние до ближайшего города": "до 30 км.",
			"Этажность": "1",
			"Общая площадь": "86 м²",
			"Количество комнат": "4",
			"Площадь участка": "27 соток",
			"Тип дома": "Дом",
			"Год постройки / сдачи": "1990 - 2000",
			"Тип стен": "Кирпичный",
			"Тип кровли": "Шифер",
			"Санузел": "Смежный",
			"Отопление": "Индивидуальное газовое",
			"Ремонт": "Косметический ремонт",
			"Бытовая техника": "Без бытовой техники\n\nПлита",
			"Мультимедиа": "Спутниковое ТВ\n\nСкоростной интернет\n\nWi-Fi",
			"Комфорт": "Подсобные помещения\n\nЗабор\n\nограждение\n\nСад\n\nогород",
			"Коммуникации": "Асфальтированная дорога\n\nЭлектричество\n\nВывоз отходов\n\nГаз\n\nСкважина",
			"Инфраструктура (до 500 метров)": "Отделение банка\n\nбанкомат\n\nАвтовокзал\n\nЦентр города\n\nАптека\n\nБольница\n\nполиклиника\n\nДетский сад\n\nРынок\n\nДетская площадка\n\nОтделение почты\n\nБювет\n\nЖД станция\n\nРесторан\n\nкафе",
			"Ландшафт (до 1 км.)": "Лес\n\nОзеро\n\nВодохранилище\n\nРека",
			"price": "49 999 $ Договорная",
			"description": "Объявление от    Частного лица         Выберите рубрику    Продажа домов           Без комиссии    Без комиссии         Расстояние до ближайшего города    до 30 км.           Этажность   1        Общая площадь   86 м²          Количество комнат   4        Площадь участка   27 соток          Тип дома    Дом         Год постройки / сдачи    1990 - 2000           Тип стен    Кирпичный         Тип кровли    Шифер           Санузел    Смежный         Отопление    Индивидуальное газовое           Ремонт    Косметический ремонт         Бытовая техника    Без бытовой техники  Плита           Мультимедиа    Спутниковое ТВ  Скоростной интернет  Wi-Fi         Комфорт    Подсобные помещения  Забор  ограждение  Сад  огород           Коммуникации    Асфальтированная дорога  Электричество  Вывоз отходов  Газ  Скважина         Инфраструктура (до 500 метров)    Отделение банка  банкомат  Автовокзал  Центр города  Аптека  Больница  поликлиника  Детский сад  Рынок  Детская площадка  Отделение почты  Бювет  ЖД станция  Ресторан  кафе           Ландшафт (до 1 км.)    Лес  Озеро  Водохранилище  Река                                                                                            Продається будинок !! Будинок знаходиться за адресою смт.Велика Димерка, Броварський р-н. 25 км. від Києва,хороша інфраструктура. Школа, дитячий садок, магазини. 50 метрів від будинку озеро,за озером Детск. майданчик (500 метрів). Не далеко від будинку церква. 5-7 хв. ходьби до центру (маршрутки до Києва, Броварів кожні 20-30 хв.) На ділянці будинок, сарай, погріб. Загальна площа ділянки: 26,5 соток  У дворі молодий сад (яблуні, груші, вишні, сливи, абрикоси, виноград ... и т.д...) сад плодоносить (3-7 років.) На ділянці своя свердловина, колодязь. Двір огороджений бетонним парканом. Окремий заїзд у двір, город. У будинку Металопластикові вікна, газовий і дров'яний котел. Є сан - вузол (туалет, душ). Одна кімната обурудована теплою підлогою. Гаряча, холодна вода (встановлений  електро - бойлер).Супутникова антена, швидкісний інтернет. Загальна площа будинку: 86 м2  Реальним покупцем торг !! Посередників прохання не турбувати !!!!",
			"images": 5,
			"location": "Большая Дымерка, Киевская область, Броварской район\n                        \n                            Показать на карте"
	},
	"https://www.olx.ua/obyavlenie/prodam-dom-160m2-starye-petrovtsy-s-kievskaya-obl-IDEx4QX.html#f7065a9d45": {
		"link": "https://www.olx.ua/obyavlenie/prodam-dom-160m2-starye-petrovtsy-s-kievskaya-obl-IDEx4QX.html#f7065a9d45",
			"Объявление от": "Частного лица",
			"Выберите рубрику": "Продажа домов",
			"Без комиссии": "",
			"Возможность обмена": "",
			"Готов сотрудничать с риэлторами": "",
			"Расстояние до ближайшего города": "до 15 км.",
			"Этажность": "2",
			"Общая площадь": "160 м²",
			"Количество комнат": "5",
			"Площадь участка": "15 соток",
			"Тип дома": "Дом",
			"Тип стен": "Кирпичный",
			"Тип кровли": "Шифер",
			"Коммуникации": "Асфальтированная дорога\n\nГаз\n\nЦентральный водопровод\n\nСкважина",
			"Инфраструктура (до 500 метров)": "Детский сад\n\nОтделение почты\n\nШкола\n\nМагазин\n\nкиоск",
			"Ландшафт (до 1 км.)": "Лес\n\nВодохранилище\n\nМоре",
			"price": "55 000 $",
			"description": "Объявление от    Частного лица         Выберите рубрику    Продажа домов           Без комиссии             Возможность обмена               Готов сотрудничать с риэлторами             Расстояние до ближайшего города    до 15 км.           Этажность   2        Общая площадь   160 м²          Количество комнат   5        Площадь участка   15 соток          Тип дома    Дом         Тип стен    Кирпичный           Тип кровли    Шифер         Коммуникации    Асфальтированная дорога  Газ  Центральный водопровод  Скважина           Инфраструктура (до 500 метров)    Детский сад  Отделение почты  Школа  Магазин  киоск         Ландшафт (до 1 км.)    Лес  Водохранилище  Море                                                                                          Продам недостроенный Дом с. Старые Петровцы ,Урочище Букаевица Продам недостроенный дом (коробка б/окон, б/дверей). Дом с. Старые Петровцы ,Урочище Букаевица. Дом двухэтажный общая площадь 160 кв. м : 1 этаж - кухня, с/у раздельный,2 спальни, котельная ; 2 этаж — 3 спальни, с/у при желании. Хозпостройки. Участок 15 соток. Гараж. Забором ограждено. Вторая улица от трассы. Газ ,вода на участке.",
			"images": 5,
			"location": "Вышгород, Киевская область, Вышгородский район\n                        \n                            Показать на карте"
	},
	"https://www.olx.ua/obyavlenie/prodazha-doma-140-kv-m-s-revnoe-ulitsa-malinovaya-32-IDDWKq3.html#f7065a9d45": {
		"link": "https://www.olx.ua/obyavlenie/prodazha-doma-140-kv-m-s-revnoe-ulitsa-malinovaya-32-IDDWKq3.html#f7065a9d45",
			"Объявление от": "Бизнес",
			"Выберите рубрику": "Продажа домов",
			"Без комиссии": "",
			"Возможность обмена": "",
			"Готов сотрудничать с риэлторами": "Готов сотрудничать с риэлторами",
			"Этажность": "2",
			"Общая площадь": "140 м²",
			"Количество комнат": "4",
			"Площадь участка": "10 соток",
			"Тип дома": "Дом",
			"price": "43 500 $ Договорная",
			"description": "Объявление от    Бизнес         Выберите рубрику    Продажа домов           Без комиссии             Возможность обмена               Готов сотрудничать с риэлторами    Готов сотрудничать с риэлторами         Этажность   2          Общая площадь   140 м²        Количество комнат   4          Площадь участка   10 соток        Тип дома    Дом                                                                                          Очень срочно! Владелец уезжает за границу! Успейте приобрести, гораздо дешевле себестоимости! Для тех людей, которые предпочитают покой, тишину и чистый воздух - городской суете, шуму и загазованности. Дом строился для себя! На материалах не экономили! Архитектура современная, планировка очень функциональная - ничего лишнего! Все продумано до мелочей, для комфортной эксплуатации. Высота потолков - 3.1м. Стены- газоблок + утеплитель 10см. Крыша- метало черепица (Словакия)+ гидробаръер, утеплитель, паробаръер. Сделана разводка под отопление. Система теплых полов, с водяным подогревом. Электричество- трансформатор на несколько собственников. В дом введено 10 кВт. Дом очень теплый. Первый этаж: большая кухня- гостинная, выход на террасу, санузел - раздельный, холл. Второй этаж: холл, три спальни (одна с гардеробной комнатой), и огромная ванная комната. Септик: выгребная яма-основная (3 кольца) и переливная (2 кольца). Скважина. Асфальтированный подъезд практически к дому, по центральной улице. Участок ровный, правильной формы. Есть навес для автомобиля. Улица \"обжитая\", большинство соседей построились, и проживают постоянно. Поселок активно развивается, много инвесторов и активистов, много проектов. Хорошая инфраструктура и транспортная развязка. Село Ревное - Киев - 16 км. Днепр - 8 км. Дом продается намного меньше себестоимости. Просмотры по договоренности. Больше информации по телефону. Возможен аргументированный торг.",
			"images": 5,
			"location": "Ревное, Киевская область, Бориспольский район                            Посмотреть на карте"
	},
	"https://www.olx.ua/obyavlenie/prodazha-podgortsy-dom-85-kv-m-v-sele-IDDexN0.html#f7065a9d45": {
		"link": "https://www.olx.ua/obyavlenie/prodazha-podgortsy-dom-85-kv-m-v-sele-IDDexN0.html#f7065a9d45",
			"Объявление от": "Бизнес",
			"Выберите рубрику": "Продажа домов",
			"Без комиссии": "",
			"Возможность обмена": "Возможность обмена",
			"Готов сотрудничать с риэлторами": "Готов сотрудничать с риэлторами",
			"Расстояние до ближайшего города": "до 10 км.",
			"Этажность": "1",
			"Общая площадь": "85 м²",
			"Количество комнат": "3",
			"Площадь участка": "45 соток",
			"Тип дома": "Дом",
			"Кадастровый номер": "3223186801:01:012:0039",
			"Год постройки / сдачи": "1960 - 1979",
			"Тип стен": "Кирпичный",
			"Тип кровли": "Шифер",
			"Санузел": "Во дворе",
			"Отопление": "Твердотоплевное",
			"Коммуникации": "Асфальтированная дорога\n\nЭлектричество\n\nГаз",
			"Инфраструктура (до 500 метров)": "Остановка транспорта",
			"Ландшафт (до 1 км.)": "Лес\n\nХолмы\n\nОзеро",
			"price": "39 000 $",
			"description": "Объявление от    Бизнес         Выберите рубрику    Продажа домов           Без комиссии             Возможность обмена    Возможность обмена           Готов сотрудничать с риэлторами    Готов сотрудничать с риэлторами         Расстояние до ближайшего города    до 10 км.           Этажность   1        Общая площадь   85 м²          Количество комнат   3        Площадь участка   45 соток          Тип дома    Дом         Кадастровый номер   3223186801:01:012:0039           Год постройки / сдачи    1960 - 1979         Тип стен    Кирпичный           Тип кровли    Шифер         Санузел    Во дворе           Отопление    Твердотоплевное         Коммуникации    Асфальтированная дорога  Электричество  Газ           Инфраструктура (до 500 метров)    Остановка транспорта         Ландшафт (до 1 км.)    Лес  Холмы  Озеро                                                                                          Продам дом в селе Подгорцы на ул. Васильковская. Старенький, 1963 г. постройки. Общая площадь 85 кв.м, три комнаты, кухня, туалет на улице. Состояние полужилое: для строителей или под ремонт. Свет в доме, газ на участке, вода - колонка. Участок 45 соток: 25 под застройку 3223186801:01:012:0039 и 20 ОСГ 3223186801:01:012:0038. Возможна продажа дома с несколькими сотками. Остановка маршруток в 30 метрах, центр села в километре.  Подъезд - хороший асфальт. Вокруг старая сельская и новая застройка. Звоните, договоримся.",
			"images": 5,
			"location": "Подгорцы, Киевская область, Обуховский район\n                        \n                            Показать на карте"
	},
	"https://www.olx.ua/obyavlenie/dom-250-m2-rassrochka-bez-v-kottedzhnom-gorodke-15-sotok-15min-kiev-IDCRSNu.html#f7065a9d45": {
		"link": "https://www.olx.ua/obyavlenie/dom-250-m2-rassrochka-bez-v-kottedzhnom-gorodke-15-sotok-15min-kiev-IDCRSNu.html#f7065a9d45",
			"Объявление от": "Частного лица",
			"Выберите рубрику": "Продажа домов",
			"Без комиссии": "Без комиссии",
			"Возможность обмена": "",
			"Готов сотрудничать с риэлторами": "Готов сотрудничать с риэлторами",
			"Расстояние до ближайшего города": "до 5 км.",
			"Этажность": "2",
			"Общая площадь": "250 м²",
			"Количество комнат": "5",
			"Площадь участка": "15 соток",
			"Тип дома": "Коттедж",
			"Кадастровый номер": "3221487004:03:004:0053",
			"Год постройки / сдачи": "2011 - 2015",
			"Внешнее утепление стен": "Пенопласт",
			"Тип кровли": "Черепица (керамическая)",
			"Санузел": "2 и более",
			"Отопление": "Индивидуальное газовое",
			"Коммуникации": "Асфальтированная дорога\n\nЭлектричество\n\nВывоз отходов\n\nГаз\n\nКанализация септик\n\nСкважина",
			"Инфраструктура (до 500 метров)": "Детский сад\n\nРынок\n\nПарк\n\nзелёная зона",
			"Ландшафт (до 1 км.)": "Лес",
			"price": "59 000 $ Договорная",
			"description": "Объявление от    Частного лица         Выберите рубрику    Продажа домов           Без комиссии    Без комиссии         Возможность обмена               Готов сотрудничать с риэлторами    Готов сотрудничать с риэлторами         Расстояние до ближайшего города    до 5 км.           Этажность   2        Общая площадь   250 м²          Количество комнат   5        Площадь участка   15 соток          Тип дома    Коттедж         Кадастровый номер   3221487004:03:004:0053           Год постройки / сдачи    2011 - 2015         Внешнее утепление стен    Пенопласт           Тип кровли    Черепица (керамическая)         Санузел    2 и более           Отопление    Индивидуальное газовое         Коммуникации    Асфальтированная дорога  Электричество  Вывоз отходов  Газ  Канализация септик  Скважина           Инфраструктура (до 500 метров)    Детский сад  Рынок  Парк  зелёная зона         Ландшафт (до 1 км.)    Лес                                                                                          Продаю добротный Коттедж в новом Коттеджном городке. До Киева 15 минут. Одесская трасса, свободная, ровная.  Возможна рассрочка без процентов!  Суперпредложение! Получается 6350 грн за 1м2, + участок 15 соток, + коммуникации.   МЕГА ВЫГОДНОЕ ПРЕДЛОЖЕНИЕ! За такие деньги нынче и половину такого не построить, не говоря об участке в 15 соток со всеми коммуникациями. А ещё есть возможность подключить зелёный тариф 30 кВт.  Без процентов, я владелец. Много просмотров, приезжайте, смотрите и вы. (Показываю как по будням так и на выходных по предварительному звонку.)  В Коттеджном городке: Асфальтированная дорога. Освещение улицы. Сам городок огорожен забором. Охрана. На въезде шлагбаум и ворота. (Пульты от шлагбаума и ворот)  Большой, ровный участок, правильной прямоугольной формы. Места столько, что можно разместить что угодно. Баня, бассейн, сад... Да что угодно влезет и еще останется. Даже можно рядом еще дом построить и разделить участок соток.  Дом качественный, все сделано добротно из надежных материалов! Добротная крыша с  черепицей. Укреплена балками дополнительно. Служить будет вечно. Крыша полностью утеплена. Внутри ровная штукатурка, в том числе откосы. Монолитное перекрытие. Гараж.  Газ. Электричество 12 кВт. (есть возможность еще поднять под зеленый тариф если кому надо. Как раз сейчас соседи подписывают новые договора с РЭС и ставят солнечные панели) Вода со скважины. Участок ровный, правильной прямоугольной формы 15 соток. Все есть.  Свободная планировка (сделан набросок перегородок).  Смотрите фото. Задавайте вопросы в сообщения. Звоните пишите по номеру (050) 773-88-31 (Звоните, пишите, Вайбер)",
			"images": 5,
			"location": "Киев, Киевская область, Соломенский\n                        \n                            Показать на карте"
	},
	"https://www.olx.ua/obyavlenie/dom-250-m2-rassrochka-bez-v-kottedzhnom-gorodke-15-sotok-15min-kiev-IDCRSNu.html#f7065a9d45;promoted": {
		"link": "https://www.olx.ua/obyavlenie/dom-250-m2-rassrochka-bez-v-kottedzhnom-gorodke-15-sotok-15min-kiev-IDCRSNu.html#f7065a9d45;promoted",
			"Объявление от": "Частного лица",
			"Выберите рубрику": "Продажа домов",
			"Без комиссии": "Без комиссии",
			"Возможность обмена": "",
			"Готов сотрудничать с риэлторами": "Готов сотрудничать с риэлторами",
			"Расстояние до ближайшего города": "до 5 км.",
			"Этажность": "2",
			"Общая площадь": "250 м²",
			"Количество комнат": "5",
			"Площадь участка": "15 соток",
			"Тип дома": "Коттедж",
			"Кадастровый номер": "3221487004:03:004:0053",
			"Год постройки / сдачи": "2011 - 2015",
			"Внешнее утепление стен": "Пенопласт",
			"Тип кровли": "Черепица (керамическая)",
			"Санузел": "2 и более",
			"Отопление": "Индивидуальное газовое",
			"Коммуникации": "Асфальтированная дорога\n\nЭлектричество\n\nВывоз отходов\n\nГаз\n\nКанализация септик\n\nСкважина",
			"Инфраструктура (до 500 метров)": "Детский сад\n\nРынок\n\nПарк\n\nзелёная зона",
			"Ландшафт (до 1 км.)": "Лес",
			"price": "59 000 $ Договорная",
			"description": "Объявление от    Частного лица         Выберите рубрику    Продажа домов           Без комиссии    Без комиссии         Возможность обмена               Готов сотрудничать с риэлторами    Готов сотрудничать с риэлторами         Расстояние до ближайшего города    до 5 км.           Этажность   2        Общая площадь   250 м²          Количество комнат   5        Площадь участка   15 соток          Тип дома    Коттедж         Кадастровый номер   3221487004:03:004:0053           Год постройки / сдачи    2011 - 2015         Внешнее утепление стен    Пенопласт           Тип кровли    Черепица (керамическая)         Санузел    2 и более           Отопление    Индивидуальное газовое         Коммуникации    Асфальтированная дорога  Электричество  Вывоз отходов  Газ  Канализация септик  Скважина           Инфраструктура (до 500 метров)    Детский сад  Рынок  Парк  зелёная зона         Ландшафт (до 1 км.)    Лес                                                                                          Продаю добротный Коттедж в новом Коттеджном городке. До Киева 15 минут. Одесская трасса, свободная, ровная.  Возможна рассрочка без процентов!  Суперпредложение! Получается 6350 грн за 1м2, + участок 15 соток, + коммуникации.   МЕГА ВЫГОДНОЕ ПРЕДЛОЖЕНИЕ! За такие деньги нынче и половину такого не построить, не говоря об участке в 15 соток со всеми коммуникациями. А ещё есть возможность подключить зелёный тариф 30 кВт.  Без процентов, я владелец. Много просмотров, приезжайте, смотрите и вы. (Показываю как по будням так и на выходных по предварительному звонку.)  В Коттеджном городке: Асфальтированная дорога. Освещение улицы. Сам городок огорожен забором. Охрана. На въезде шлагбаум и ворота. (Пульты от шлагбаума и ворот)  Большой, ровный участок, правильной прямоугольной формы. Места столько, что можно разместить что угодно. Баня, бассейн, сад... Да что угодно влезет и еще останется. Даже можно рядом еще дом построить и разделить участок соток.  Дом качественный, все сделано добротно из надежных материалов! Добротная крыша с  черепицей. Укреплена балками дополнительно. Служить будет вечно. Крыша полностью утеплена. Внутри ровная штукатурка, в том числе откосы. Монолитное перекрытие. Гараж.  Газ. Электричество 12 кВт. (есть возможность еще поднять под зеленый тариф если кому надо. Как раз сейчас соседи подписывают новые договора с РЭС и ставят солнечные панели) Вода со скважины. Участок ровный, правильной прямоугольной формы 15 соток. Все есть.  Свободная планировка (сделан набросок перегородок).  Смотрите фото. Задавайте вопросы в сообщения. Звоните пишите по номеру (050) 773-88-31 (Звоните, пишите, Вайбер)",
			"images": 5,
			"location": "Киев, Киевская область, Соломенский\n                        \n                            Показать на карте"
	},
	"https://www.olx.ua/obyavlenie/prodam-svoy-dom-v-s-pilipovichi-kievskoy-obl-IDEuKju.html#f7065a9d45": {
		"link": "https://www.olx.ua/obyavlenie/prodam-svoy-dom-v-s-pilipovichi-kievskoy-obl-IDEuKju.html#f7065a9d45",
			"Объявление от": "Частного лица",
			"Выберите рубрику": "Продажа домов",
			"Без комиссии": "Без комиссии",
			"Возможность обмена": "",
			"Готов сотрудничать с риэлторами": "",
			"Расстояние до ближайшего города": "до 5 км.",
			"Этажность": "1",
			"Общая площадь": "120 м²",
			"Количество комнат": "5",
			"Площадь участка": "15 соток",
			"Тип дома": "Дом",
			"Год постройки / сдачи": "После 2015",
			"Тип стен": "Газоблок",
			"Внешнее утепление стен": "Пенопласт",
			"Тип кровли": "Металлочерепица",
			"Санузел": "2 и более",
			"Отопление": "Твердотоплевное",
			"Ремонт": "Жилое состояние",
			"Меблирование": "Да",
			"Бытовая техника": "Посудомоечная машина\n\nХолодильник\n\nВарочная панель\n\nМикроволновая печь\n\nДуховой шкаф\n\nСтиральная машина",
			"Мультимедиа": "Кабельное\n\nцифровое ТВ\n\nСкоростной интернет",
			"Комфорт": "Беседка\n\nмангал\n\nПодсобные помещения\n\nКондиционер\n\nВанна\n\nЗабор\n\nограждение\n\nКамин\n\nГараж\n\nСад\n\nогород",
			"Коммуникации": "Асфальтированная дорога\n\nЭлектричество\n\nВывоз отходов\n\nКанализация септик\n\nЦентральный водопровод",
			"Инфраструктура (до 500 метров)": "Отделение банка\n\nбанкомат\n\nАптека\n\nБольница\n\nполиклиника\n\nДетский сад\n\nДетская площадка\n\nОтделение почты\n\nЖД станция\n\nРесторан\n\nкафе",
			"Ландшафт (до 1 км.)": "Лес\n\nОзеро",
			"price": "75 000 $",
			"description": "Объявление от    Частного лица         Выберите рубрику    Продажа домов           Без комиссии    Без комиссии         Возможность обмена               Готов сотрудничать с риэлторами             Расстояние до ближайшего города    до 5 км.           Этажность   1        Общая площадь   120 м²          Количество комнат   5        Площадь участка   15 соток          Тип дома    Дом         Год постройки / сдачи    После 2015           Тип стен    Газоблок         Внешнее утепление стен    Пенопласт           Тип кровли    Металлочерепица         Санузел    2 и более           Отопление    Твердотоплевное         Ремонт    Жилое состояние           Меблирование    Да         Бытовая техника    Посудомоечная машина  Холодильник  Варочная панель  Микроволновая печь  Духовой шкаф  Стиральная машина           Мультимедиа    Кабельное  цифровое ТВ  Скоростной интернет         Комфорт    Беседка  мангал  Подсобные помещения  Кондиционер  Ванна  Забор  ограждение  Камин  Гараж  Сад  огород           Коммуникации    Асфальтированная дорога  Электричество  Вывоз отходов  Канализация септик  Центральный водопровод         Инфраструктура (до 500 метров)    Отделение банка  банкомат  Аптека  Больница  поликлиника  Детский сад  Детская площадка  Отделение почты  ЖД станция  Ресторан  кафе           Ландшафт (до 1 км.)    Лес  Озеро                                                                                            Продам уютный тёплый дом в с. Пилиповичи Киевской обл.  Молодой плодоносящий сад 32 фруктовых дерева, малина,крыжовник, разная смородина, клубника вёдрами! Абсолютный центр села, всё рядом! На участке летний душ, сауна, бассейн, ,детская площадка, беседка, каптильня. Удобная транспортная развязка, жд 5 минут, лес, озеро, супер ! Вам понравится!!!    503 - Показать номер -  Михаил.",
			"images": 5,
			"location": "Бородянка, Киевская область, Бородянский район\n                        \n                            Показать на карте"
	},
	"https://www.olx.ua/obyavlenie/prodam-svoy-dom-v-s-pilipovichi-kievskoy-obl-IDEuKju.html#f7065a9d45;promoted": {
		"link": "https://www.olx.ua/obyavlenie/prodam-svoy-dom-v-s-pilipovichi-kievskoy-obl-IDEuKju.html#f7065a9d45;promoted",
			"Объявление от": "Частного лица",
			"Выберите рубрику": "Продажа домов",
			"Без комиссии": "Без комиссии",
			"Возможность обмена": "",
			"Готов сотрудничать с риэлторами": "",
			"Расстояние до ближайшего города": "до 5 км.",
			"Этажность": "1",
			"Общая площадь": "120 м²",
			"Количество комнат": "5",
			"Площадь участка": "15 соток",
			"Тип дома": "Дом",
			"Год постройки / сдачи": "После 2015",
			"Тип стен": "Газоблок",
			"Внешнее утепление стен": "Пенопласт",
			"Тип кровли": "Металлочерепица",
			"Санузел": "2 и более",
			"Отопление": "Твердотоплевное",
			"Ремонт": "Жилое состояние",
			"Меблирование": "Да",
			"Бытовая техника": "Посудомоечная машина\n\nХолодильник\n\nВарочная панель\n\nМикроволновая печь\n\nДуховой шкаф\n\nСтиральная машина",
			"Мультимедиа": "Кабельное\n\nцифровое ТВ\n\nСкоростной интернет",
			"Комфорт": "Беседка\n\nмангал\n\nПодсобные помещения\n\nКондиционер\n\nВанна\n\nЗабор\n\nограждение\n\nКамин\n\nГараж\n\nСад\n\nогород",
			"Коммуникации": "Асфальтированная дорога\n\nЭлектричество\n\nВывоз отходов\n\nКанализация септик\n\nЦентральный водопровод",
			"Инфраструктура (до 500 метров)": "Отделение банка\n\nбанкомат\n\nАптека\n\nБольница\n\nполиклиника\n\nДетский сад\n\nДетская площадка\n\nОтделение почты\n\nЖД станция\n\nРесторан\n\nкафе",
			"Ландшафт (до 1 км.)": "Лес\n\nОзеро",
			"price": "75 000 $",
			"description": "Объявление от    Частного лица         Выберите рубрику    Продажа домов           Без комиссии    Без комиссии         Возможность обмена               Готов сотрудничать с риэлторами             Расстояние до ближайшего города    до 5 км.           Этажность   1        Общая площадь   120 м²          Количество комнат   5        Площадь участка   15 соток          Тип дома    Дом         Год постройки / сдачи    После 2015           Тип стен    Газоблок         Внешнее утепление стен    Пенопласт           Тип кровли    Металлочерепица         Санузел    2 и более           Отопление    Твердотоплевное         Ремонт    Жилое состояние           Меблирование    Да         Бытовая техника    Посудомоечная машина  Холодильник  Варочная панель  Микроволновая печь  Духовой шкаф  Стиральная машина           Мультимедиа    Кабельное  цифровое ТВ  Скоростной интернет         Комфорт    Беседка  мангал  Подсобные помещения  Кондиционер  Ванна  Забор  ограждение  Камин  Гараж  Сад  огород           Коммуникации    Асфальтированная дорога  Электричество  Вывоз отходов  Канализация септик  Центральный водопровод         Инфраструктура (до 500 метров)    Отделение банка  банкомат  Аптека  Больница  поликлиника  Детский сад  Детская площадка  Отделение почты  ЖД станция  Ресторан  кафе           Ландшафт (до 1 км.)    Лес  Озеро                                                                                            Продам уютный тёплый дом в с. Пилиповичи Киевской обл.  Молодой плодоносящий сад 32 фруктовых дерева, малина,крыжовник, разная смородина, клубника вёдрами! Абсолютный центр села, всё рядом! На участке летний душ, сауна, бассейн, ,детская площадка, беседка, каптильня. Удобная транспортная развязка, жд 5 минут, лес, озеро, супер ! Вам понравится!!!    503 - Показать номер -  Михаил.",
			"images": 5,
			"location": "Бородянка, Киевская область, Бородянский район\n                        \n                            Показать на карте"
	},
	"https://www.olx.ua/obyavlenie/belogorodka-ul-lenina-168-dom-22-sotki-zemli-ID4gYMR.html#f7065a9d45": {
		"link": "https://www.olx.ua/obyavlenie/belogorodka-ul-lenina-168-dom-22-sotki-zemli-ID4gYMR.html#f7065a9d45",
			"Объявление от": "Частного лица",
			"Выберите рубрику": "Продажа домов",
			"Без комиссии": "Без комиссии",
			"Возможность обмена": "Возможность обмена",
			"Готов сотрудничать с риэлторами": "Готов сотрудничать с риэлторами",
			"Расстояние до ближайшего города": "до 15 км.",
			"Этажность": "1",
			"Общая площадь": "80 м²",
			"Количество комнат": "3",
			"Площадь участка": "22 соток",
			"Тип дома": "Дом",
			"Тип стен": "Кирпичный",
			"Санузел": "Смежный",
			"Отопление": "Индивидуальное газовое",
			"Ремонт": "Жилое состояние",
			"Бытовая техника": "Холодильник\n\nПлита",
			"Комфорт": "Подсобные помещения\n\nВанна\n\nЗабор\n\nограждение",
			"Коммуникации": "Асфальтированная дорога\n\nЭлектричество\n\nГаз\n\nСкважина",
			"Инфраструктура (до 500 метров)": "Детский сад\n\nШкола\n\nОстановка транспорта",
			"Ландшафт (до 1 км.)": "Лес\n\nРека",
			"price": "53 000 $ Договорная",
			"description": "Объявление от    Частного лица         Выберите рубрику    Продажа домов           Без комиссии    Без комиссии         Возможность обмена    Возможность обмена           Готов сотрудничать с риэлторами    Готов сотрудничать с риэлторами         Расстояние до ближайшего города    до 15 км.           Этажность   1        Общая площадь   80 м²          Количество комнат   3        Площадь участка   22 соток          Тип дома    Дом         Тип стен    Кирпичный           Санузел    Смежный         Отопление    Индивидуальное газовое           Ремонт    Жилое состояние         Бытовая техника    Холодильник  Плита           Комфорт    Подсобные помещения  Ванна  Забор  ограждение         Коммуникации    Асфальтированная дорога  Электричество  Газ  Скважина           Инфраструктура (до 500 метров)    Детский сад  Школа  Остановка транспорта         Ландшафт (до 1 км.)    Лес  Река                                                                                          Продам добротный кирпичный дом, сарай, погреб, хоз. постройки. Участок 22 сотки участок обрабатывается не запущен  10-12 км от окружной хороший подъезд фасад центральной улица с. Белогородка, рядом лес, школа, магазины, маршрутка возле дома, хорошие соседи, телефон, газ, электричество, с/у в доме совмещённый, вода в доме - скважина+насосная станция, цена 53000 долл.",
			"images": 5,
			"location": "Белогородка, Киевская область, Киево-Святошинский район\n                        \n                            Показать на карте"
	},
	"https://www.olx.ua/obyavlenie/prodazha-termodoma-s-bolshim-uchastkom-novoselki-nedaleko-desna-IDEkcPi.html#f7065a9d45": {
		"link": "https://www.olx.ua/obyavlenie/prodazha-termodoma-s-bolshim-uchastkom-novoselki-nedaleko-desna-IDEkcPi.html#f7065a9d45",
			"Объявление от": "Бизнес",
			"Выберите рубрику": "Продажа домов",
			"Без комиссии": "",
			"Возможность обмена": "",
			"Готов сотрудничать с риэлторами": "",
			"Расстояние до ближайшего города": "до 20 км.",
			"Этажность": "2",
			"Общая площадь": "280 м²",
			"Количество комнат": "6",
			"Площадь участка": "15 соток",
			"Тип дома": "Коттедж",
			"Тип стен": "Кирпичный",
			"Санузел": "2 и более",
			"Ремонт": "Под чистовую отделку",
			"Коммуникации": "Асфальтированная дорога\n\nЦентральная канализация\n\nЭлектричество\n\nГаз\n\nСкважина",
			"Инфраструктура (до 500 метров)": "Аптека\n\nБольница\n\nполиклиника\n\nДетский сад\n\nРынок\n\nДетская площадка\n\nОтделение почты\n\nШкола\n\nМагазин",
			"Ландшафт (до 1 км.)": "Лес\n\nОзеро\n\nРека",
			"price": "60 000 $",
			"description": "Объявление от    Бизнес         Выберите рубрику    Продажа домов           Без комиссии             Возможность обмена               Готов сотрудничать с риэлторами             Расстояние до ближайшего города    до 20 км.           Этажность   2        Общая площадь   280 м²          Количество комнат   6        Площадь участка   15 соток          Тип дома    Коттедж         Тип стен    Кирпичный           Санузел    2 и более         Ремонт    Под чистовую отделку           Коммуникации    Асфальтированная дорога  Центральная канализация  Электричество  Газ  Скважина         Инфраструктура (до 500 метров)    Аптека  Больница  поликлиника  Детский сад  Рынок  Детская площадка  Отделение почты  Школа  Магазин           Ландшафт (до 1 км.)    Лес  Озеро  Река                                                                                            Продается новый дом с мансардой 280 кв.м,вместе с гаражом. Вышгородский район, Новоселки, 21 км от Киева. Дом строился для себя, строительные материалы достаточно качественные,относится к статусу термодом .Крыша покрыта одним из новейших кровельных материалов напоминающий шелк, надежный и долговечный. 1 этаж: гостиная с камином 34 кв м, кухня-столовая 26 кв м, спальня 14 кв м, гардеробная, с/узел, душевая,большой коридор 20 кв м,хозяйственная комната (котельная), тамбур. 2 этаж:3 спальни (32 кв м, 20 кв м, 14 кв м), холл 12 кв м, кабинет 16 кв м, гардеробная 13 кв м, большая ванная комната 25 кв м, 2 балкона. В дом заведен газ,разводка, котел, заведена вода (скважина), электричество.Канализация централизована. На территории отличный погреб. Также на территории есть небольшой домик из ракушняка, с гаражом, есть свет. Можно пользоваться как гостевой. Дом расположен в отличном супер месте (почти центр), но тихо,спокойно. Тупиковая улица.Есть адрес, прописка. Земельный участок 15 соток, есть рядом / граничит/ пустой участок 15 соток (продается). Рядом детская площадка, школа, церковь. К красивому чистому, прозрачному озеру буквально до 200 метров. Озеро очень большое, пляж. К Десне (с пляжем) 800м Дом полностью готов принять Ваши дизайнерские фантазии!  Возможно закончить \"под ключ\" по Вашим идеям. Рядом остановка общественного транспорта. Автобус едет до М» Героев Днепра».  60000 у.е.(для реального покупателя ТОРГ.)",
			"images": 5,
			"location": "Новоселки, Киевская область, Вышгородский район\n                        \n                            Показать на карте"
	},
	"https://www.olx.ua/obyavlenie/prodazha-termodoma-s-bolshim-uchastkom-novoselki-nedaleko-desna-IDEkcPi.html#f7065a9d45;promoted": {
		"link": "https://www.olx.ua/obyavlenie/prodazha-termodoma-s-bolshim-uchastkom-novoselki-nedaleko-desna-IDEkcPi.html#f7065a9d45;promoted",
			"Объявление от": "Бизнес",
			"Выберите рубрику": "Продажа домов",
			"Без комиссии": "",
			"Возможность обмена": "",
			"Готов сотрудничать с риэлторами": "",
			"Расстояние до ближайшего города": "до 20 км.",
			"Этажность": "2",
			"Общая площадь": "280 м²",
			"Количество комнат": "6",
			"Площадь участка": "15 соток",
			"Тип дома": "Коттедж",
			"Тип стен": "Кирпичный",
			"Санузел": "2 и более",
			"Ремонт": "Под чистовую отделку",
			"Коммуникации": "Асфальтированная дорога\n\nЦентральная канализация\n\nЭлектричество\n\nГаз\n\nСкважина",
			"Инфраструктура (до 500 метров)": "Аптека\n\nБольница\n\nполиклиника\n\nДетский сад\n\nРынок\n\nДетская площадка\n\nОтделение почты\n\nШкола\n\nМагазин",
			"Ландшафт (до 1 км.)": "Лес\n\nОзеро\n\nРека",
			"price": "60 000 $",
			"description": "Объявление от    Бизнес         Выберите рубрику    Продажа домов           Без комиссии             Возможность обмена               Готов сотрудничать с риэлторами             Расстояние до ближайшего города    до 20 км.           Этажность   2        Общая площадь   280 м²          Количество комнат   6        Площадь участка   15 соток          Тип дома    Коттедж         Тип стен    Кирпичный           Санузел    2 и более         Ремонт    Под чистовую отделку           Коммуникации    Асфальтированная дорога  Центральная канализация  Электричество  Газ  Скважина         Инфраструктура (до 500 метров)    Аптека  Больница  поликлиника  Детский сад  Рынок  Детская площадка  Отделение почты  Школа  Магазин           Ландшафт (до 1 км.)    Лес  Озеро  Река                                                                                            Продается новый дом с мансардой 280 кв.м,вместе с гаражом. Вышгородский район, Новоселки, 21 км от Киева. Дом строился для себя, строительные материалы достаточно качественные,относится к статусу термодом .Крыша покрыта одним из новейших кровельных материалов напоминающий шелк, надежный и долговечный. 1 этаж: гостиная с камином 34 кв м, кухня-столовая 26 кв м, спальня 14 кв м, гардеробная, с/узел, душевая,большой коридор 20 кв м,хозяйственная комната (котельная), тамбур. 2 этаж:3 спальни (32 кв м, 20 кв м, 14 кв м), холл 12 кв м, кабинет 16 кв м, гардеробная 13 кв м, большая ванная комната 25 кв м, 2 балкона. В дом заведен газ,разводка, котел, заведена вода (скважина), электричество.Канализация централизована. На территории отличный погреб. Также на территории есть небольшой домик из ракушняка, с гаражом, есть свет. Можно пользоваться как гостевой. Дом расположен в отличном супер месте (почти центр), но тихо,спокойно. Тупиковая улица.Есть адрес, прописка. Земельный участок 15 соток, есть рядом / граничит/ пустой участок 15 соток (продается). Рядом детская площадка, школа, церковь. К красивому чистому, прозрачному озеру буквально до 200 метров. Озеро очень большое, пляж. К Десне (с пляжем) 800м Дом полностью готов принять Ваши дизайнерские фантазии!  Возможно закончить \"под ключ\" по Вашим идеям. Рядом остановка общественного транспорта. Автобус едет до М» Героев Днепра».  60000 у.е.(для реального покупателя ТОРГ.)",
			"images": 5,
			"location": "Новоселки, Киевская область, Вышгородский район\n                        \n                            Показать на карте"
	},
	"https://www.olx.ua/obyavlenie/budinok-za-tsnoyu-2-kmnatno-kvartiri-IDszD76.html#f7065a9d45": {
		"link": "https://www.olx.ua/obyavlenie/budinok-za-tsnoyu-2-kmnatno-kvartiri-IDszD76.html#f7065a9d45",
			"Объявление от": "Частного лица",
			"Выберите рубрику": "Продажа домов",
			"Без комиссии": "Без комиссии",
			"Возможность обмена": "Возможность обмена",
			"Готов сотрудничать с риэлторами": "Готов сотрудничать с риэлторами",
			"Расстояние до ближайшего города": "до 10 км.",
			"Этажность": "2",
			"Общая площадь": "180 м²",
			"Количество комнат": "6",
			"Площадь участка": "12 соток",
			"Тип дома": "Дом",
			"price": "59 000 $",
			"description": "Объявление от    Частного лица         Выберите рубрику    Продажа домов           Без комиссии    Без комиссии         Возможность обмена    Возможность обмена           Готов сотрудничать с риэлторами    Готов сотрудничать с риэлторами         Расстояние до ближайшего города    до 10 км.           Этажность   2        Общая площадь   180 м²          Количество комнат   6        Площадь участка   12 соток          Тип дома    Дом                                                                                            Шикарный загородный дом с экологически чистых материалов с.Тарасовка Киево-Святошинский р-н : 3 этажа, общая площадь - 320 кв.м., жилая площадь – 198м.кв., ровный участок - 12 соток. От моста \"Жуляны\" Окружной дороги 11 км. Рядом магазин, остановка маршрутки.   Облицовочный кирпич, внутренние стены - ракушняк, красивые эркерные окна, экологически чистые материалы, покрытие крыши - металочерепица, скважина + септик. Строился для себя. Полный комплект документов.",
			"images": 5,
			"location": "Тарасовка, Киевская область, Киево-Святошинский район\n                        \n                            Показать на карте"
	},
	"https://www.olx.ua/obyavlenie/budinok-za-tsnoyu-2-kmnatno-kvartiri-IDszD76.html#f7065a9d45;promoted": {
		"link": "https://www.olx.ua/obyavlenie/budinok-za-tsnoyu-2-kmnatno-kvartiri-IDszD76.html#f7065a9d45;promoted",
			"Объявление от": "Частного лица",
			"Выберите рубрику": "Продажа домов",
			"Без комиссии": "Без комиссии",
			"Возможность обмена": "Возможность обмена",
			"Готов сотрудничать с риэлторами": "Готов сотрудничать с риэлторами",
			"Расстояние до ближайшего города": "до 10 км.",
			"Этажность": "2",
			"Общая площадь": "180 м²",
			"Количество комнат": "6",
			"Площадь участка": "12 соток",
			"Тип дома": "Дом",
			"price": "59 000 $",
			"description": "Объявление от    Частного лица         Выберите рубрику    Продажа домов           Без комиссии    Без комиссии         Возможность обмена    Возможность обмена           Готов сотрудничать с риэлторами    Готов сотрудничать с риэлторами         Расстояние до ближайшего города    до 10 км.           Этажность   2        Общая площадь   180 м²          Количество комнат   6        Площадь участка   12 соток          Тип дома    Дом                                                                                            Шикарный загородный дом с экологически чистых материалов с.Тарасовка Киево-Святошинский р-н : 3 этажа, общая площадь - 320 кв.м., жилая площадь – 198м.кв., ровный участок - 12 соток. От моста \"Жуляны\" Окружной дороги 11 км. Рядом магазин, остановка маршрутки.   Облицовочный кирпич, внутренние стены - ракушняк, красивые эркерные окна, экологически чистые материалы, покрытие крыши - металочерепица, скважина + септик. Строился для себя. Полный комплект документов.",
			"images": 5,
			"location": "Тарасовка, Киевская область, Киево-Святошинский район\n                        \n                            Показать на карте"
	},
	"https://www.olx.ua/obyavlenie/prodazha-novogo-doma-v-bortnichah-st-ekonomist-bez-komissii-IDAUfGu.html#f7065a9d45": {
		"link": "https://www.olx.ua/obyavlenie/prodazha-novogo-doma-v-bortnichah-st-ekonomist-bez-komissii-IDAUfGu.html#f7065a9d45",
			"Объявление от": "Бизнес",
			"Выберите рубрику": "Продажа домов",
			"Без комиссии": "Без комиссии",
			"Возможность обмена": "",
			"Готов сотрудничать с риэлторами": "",
			"Расстояние до ближайшего города": "до 5 км.",
			"Этажность": "2",
			"Общая площадь": "150 м²",
			"Количество комнат": "3",
			"Площадь участка": "10 соток",
			"Тип дома": "Дом",
			"Кадастровый номер": "3220882600:04:006:0040",
			"Год постройки / сдачи": "2011 - 2015",
			"Внешнее утепление стен": "Минеральная вата",
			"Тип кровли": "Битумная черепица",
			"Санузел": "2 и более",
			"Отопление": "Твердотоплевное",
			"Комфорт": "Цоколь\n\nподвал\n\nСад\n\nогород",
			"Коммуникации": "Электричество\n\nКанализация септик\n\nСкважина",
			"Ландшафт (до 1 км.)": "Озеро",
			"price": "45 000 $",
			"description": "Объявление от    Бизнес         Выберите рубрику    Продажа домов           Без комиссии    Без комиссии         Возможность обмена               Готов сотрудничать с риэлторами             Расстояние до ближайшего города    до 5 км.           Этажность   2        Общая площадь   150 м²          Количество комнат   3        Площадь участка   10 соток          Тип дома    Дом         Кадастровый номер   3220882600:04:006:0040           Год постройки / сдачи    2011 - 2015         Внешнее утепление стен    Минеральная вата           Тип кровли    Битумная черепица         Санузел    2 и более           Отопление    Твердотоплевное         Комфорт    Цоколь  подвал  Сад  огород           Коммуникации    Электричество  Канализация септик  Скважина         Ландшафт (до 1 км.)    Озеро                                                                                          Дом в Бортничах, закрытый охраняемый кооператив \"Экономист\", 26 км от Крещатика, 7 км от ст. метро Бориспольская, ул. Левадная. Дом 7,5м Х 11м, 2 этажа + утеплённая мансарда, подвал на весь периметр дома. Залита плита под гараж. 10 соток. Фасад 37м на 27м.  Молодой плодоносящий сад (слива, груша, вишня, черешня, нектарин.)  Скважина 75м, двухсекционная выгребная яма 3 куб.м. Навес для дров. Дом построен из ракушечника, стены 40 см., второй этаж утеплён минватой и обшит сайдингом. Ж/б перекрытия, металлопластиковые окна Rehau, канадская трёхслойная битумная черепица.  Медная проводка, три фазы, двухтарифный счётчик. Кабельный интернет (оптоволокно). 1 этаж - потолки 3,2м, отапливается булерьяном, есть фундамент под печь: кухня-гостиная комната 14.5 кв. м, санузел 6.7 кв. м – под чистовую отделку, все коммуникации, стяжка, известковая штукатурка. 2 этаж - потолки 2,7м, тёплые электрические полы: 2 спальни по 15 и 19 кв. м, гостиная, холл, в с/у бойлер – ремонт 2016 года Мансарда – свободное планирование. Рядом озеро, песчаный пляж, рыбалка. Хорошие соседи. 45000 долл. США, (233 долл. за кв.м!)  Без комиссии  672 - Показать номер -  Роман",
			"images": 5,
			"location": "Гнедин, Киевская область, Бориспольский район\n                        \n                            Показать на карте"
	},
	"https://www.olx.ua/obyavlenie/prodazha-novogo-doma-v-bortnichah-st-ekonomist-bez-komissii-IDAUfGu.html#f7065a9d45;promoted": {
		"link": "https://www.olx.ua/obyavlenie/prodazha-novogo-doma-v-bortnichah-st-ekonomist-bez-komissii-IDAUfGu.html#f7065a9d45;promoted",
			"Объявление от": "Бизнес",
			"Выберите рубрику": "Продажа домов",
			"Без комиссии": "Без комиссии",
			"Возможность обмена": "",
			"Готов сотрудничать с риэлторами": "",
			"Расстояние до ближайшего города": "до 5 км.",
			"Этажность": "2",
			"Общая площадь": "150 м²",
			"Количество комнат": "3",
			"Площадь участка": "10 соток",
			"Тип дома": "Дом",
			"Кадастровый номер": "3220882600:04:006:0040",
			"Год постройки / сдачи": "2011 - 2015",
			"Внешнее утепление стен": "Минеральная вата",
			"Тип кровли": "Битумная черепица",
			"Санузел": "2 и более",
			"Отопление": "Твердотоплевное",
			"Комфорт": "Цоколь\n\nподвал\n\nСад\n\nогород",
			"Коммуникации": "Электричество\n\nКанализация септик\n\nСкважина",
			"Ландшафт (до 1 км.)": "Озеро",
			"price": "45 000 $",
			"description": "Объявление от    Бизнес         Выберите рубрику    Продажа домов           Без комиссии    Без комиссии         Возможность обмена               Готов сотрудничать с риэлторами             Расстояние до ближайшего города    до 5 км.           Этажность   2        Общая площадь   150 м²          Количество комнат   3        Площадь участка   10 соток          Тип дома    Дом         Кадастровый номер   3220882600:04:006:0040           Год постройки / сдачи    2011 - 2015         Внешнее утепление стен    Минеральная вата           Тип кровли    Битумная черепица         Санузел    2 и более           Отопление    Твердотоплевное         Комфорт    Цоколь  подвал  Сад  огород           Коммуникации    Электричество  Канализация септик  Скважина         Ландшафт (до 1 км.)    Озеро                                                                                          Дом в Бортничах, закрытый охраняемый кооператив \"Экономист\", 26 км от Крещатика, 7 км от ст. метро Бориспольская, ул. Левадная. Дом 7,5м Х 11м, 2 этажа + утеплённая мансарда, подвал на весь периметр дома. Залита плита под гараж. 10 соток. Фасад 37м на 27м.  Молодой плодоносящий сад (слива, груша, вишня, черешня, нектарин.)  Скважина 75м, двухсекционная выгребная яма 3 куб.м. Навес для дров. Дом построен из ракушечника, стены 40 см., второй этаж утеплён минватой и обшит сайдингом. Ж/б перекрытия, металлопластиковые окна Rehau, канадская трёхслойная битумная черепица.  Медная проводка, три фазы, двухтарифный счётчик. Кабельный интернет (оптоволокно). 1 этаж - потолки 3,2м, отапливается булерьяном, есть фундамент под печь: кухня-гостиная комната 14.5 кв. м, санузел 6.7 кв. м – под чистовую отделку, все коммуникации, стяжка, известковая штукатурка. 2 этаж - потолки 2,7м, тёплые электрические полы: 2 спальни по 15 и 19 кв. м, гостиная, холл, в с/у бойлер – ремонт 2016 года Мансарда – свободное планирование. Рядом озеро, песчаный пляж, рыбалка. Хорошие соседи. 45000 долл. США, (233 долл. за кв.м!)  Без комиссии  672 - Показать номер -  Роман",
			"images": 5,
			"location": "Гнедин, Киевская область, Бориспольский район\n                        \n                            Показать на карте"
	},
	"https://www.olx.ua/obyavlenie/gotovyy-taunhaus-v-irpene-IDEvZGj.html#f7065a9d45": {
		"link": "https://www.olx.ua/obyavlenie/gotovyy-taunhaus-v-irpene-IDEvZGj.html#f7065a9d45",
			"Объявление от": "Бизнес",
			"Выберите рубрику": "Продажа домов",
			"Без комиссии": "Без комиссии",
			"Этажность": "2",
			"Общая площадь": "110 м²",
			"Количество комнат": "4",
			"Площадь участка": "130 соток",
			"Тип дома": "Дом",
			"Санузел": "Раздельный",
			"Отопление": "Индивидуальное газовое",
			"Ремонт": "Под чистовую отделку",
			"price": "55 000 $",
			"description": "Объявление от    Бизнес         Выберите рубрику    Продажа домов           Без комиссии    Без комиссии         Этажность   2          Общая площадь   110 м²        Количество комнат   4          Площадь участка   130 соток        Тип дома    Дом           Санузел    Раздельный         Отопление    Индивидуальное газовое           Ремонт    Под чистовую отделку                                                                                            Продам таунхаус в Ирпене по ул. Киевской.  Общая площадь 110 кв.м., жилая 54,2 кв.м., кухня гостиная 26 кв.м., 1,3 сот. земли.  Дом построен с керамического кирпича + утеплитель, ж/б перекрытие, крыша - метало черепица.  В доме индивидуальное газовое отопление (2-х контурный котел), теплый пол (сан. узел, рабочая зона в кухне), чистовая штукатурка стен, стяжка пола, м/п окна.  Коммуникации центральные - свет, газ, вода, канализация.  Закрытая придомовая территория, во дворе тротуарная плитка, парко место.  Стоимость 55 000 у.е.  Без комиссии.  Более подробно по телефону, с Уважением Светлана.  Компанія: АН Партнер",
			"images": 5,
			"location": "Ирпень, Киевская область                            Посмотреть на карте"
	},
	"https://www.olx.ua/obyavlenie/prodam-budinok-dom-s-velik-komyati-mozhliviy-obmn-na-avto-ID7RqYD.html#f7065a9d45": {
		"link": "https://www.olx.ua/obyavlenie/prodam-budinok-dom-s-velik-komyati-mozhliviy-obmn-na-avto-ID7RqYD.html#f7065a9d45",
			"Объявление от": "Бизнес",
			"Выберите рубрику": "Продажа домов",
			"Этажность": "3",
			"Общая площадь": "200 м²",
			"Количество комнат": "8",
			"Площадь участка": "20 соток",
			"Тип дома": "Дом",
			"price": "25 000 $ Договорная",
			"description": "Объявление от    Бизнес         Выберите рубрику    Продажа домов           Этажность   3        Общая площадь   200 м²          Количество комнат   8        Площадь участка   20 соток          Тип дома    Дом                                                                                            с. Великі Комяти  Можливий обмін на автомобіль  характеристика участка размещение участка: в населенном пункте; коммуникации газ: на участке; электричество: в доме;  Будинок якісно побудований! Фундамент глибина 1,5 ( в землі) Стіни цегла 50см Два монолітні перекриття.",
			"images": 5,
			"location": "Виноградов, Закарпатская область, Виноградовский район\n                        \n                            Показать на карте"
	},
	"https://www.olx.ua/obyavlenie/prodam-zhiliy-budinok-v-s-vishenki-na-23-sotkah-zeml-IDuAcim.html#f7065a9d45": {
		"link": "https://www.olx.ua/obyavlenie/prodam-zhiliy-budinok-v-s-vishenki-na-23-sotkah-zeml-IDuAcim.html#f7065a9d45",
			"Объявление от": "Бизнес",
			"Выберите рубрику": "Продажа домов",
			"Без комиссии": "Без комиссии",
			"Возможность обмена": "",
			"Готов сотрудничать с риэлторами": "",
			"Этажность": "1",
			"Общая площадь": "114 м²",
			"Количество комнат": "6",
			"Площадь участка": "23 соток",
			"Тип дома": "Дом",
			"Ремонт": "Жилое состояние",
			"Меблирование": "Да",
			"Мультимедиа": "Скоростной интернет",
			"Комфорт": "Подсобные помещения\n\nВанна\n\nЗабор\n\nограждение\n\nКамин\n\nГараж\n\nСад",
			"Коммуникации": "Асфальтированная дорога\n\nЭлектричество\n\nВывоз отходов\n\nГаз\n\nКанализация септик\n\nСкважина",
			"Инфраструктура (до 500 метров)": "Отделение банка\n\nбанкомат\n\nЦентр города\n\nАптека\n\nБольница\n\nполиклиника\n\nДетский сад\n\nРынок\n\nПарк\n\nзелёная зона\n\nДетская площадка\n\nОтделение почты\n\nРесторан\n\nкафе",
			"Ландшафт (до 1 км.)": "Лес\n\nОзеро\n\nРека",
			"price": "45 000 $",
			"description": "Объявление от    Бизнес         Выберите рубрику    Продажа домов           Без комиссии    Без комиссии         Возможность обмена               Готов сотрудничать с риэлторами             Этажность   1          Общая площадь   114 м²        Количество комнат   6          Площадь участка   23 соток        Тип дома    Дом           Ремонт    Жилое состояние         Меблирование    Да           Мультимедиа    Скоростной интернет         Комфорт    Подсобные помещения  Ванна  Забор  ограждение  Камин  Гараж  Сад           Коммуникации    Асфальтированная дорога  Электричество  Вывоз отходов  Газ  Канализация септик  Скважина         Инфраструктура (до 500 метров)    Отделение банка  банкомат  Центр города  Аптека  Больница  поликлиника  Детский сад  Рынок  Парк  зелёная зона  Детская площадка  Отделение почты  Ресторан  кафе           Ландшафт (до 1 км.)    Лес  Озеро  Река                                                                                            ПРОДАМ жилий БУДИНОК 68 кв.м. (+48 кв.м мансарда) в с. ВИШЕНЬКИ на 23 сотках землі.  З ремонтом.  Будинок жилий.  В селі. Жилий облаштований район. Асфальтна дорога.  Будинок 1-поверховий з мансардним поверхом. Загальна Площа будинку - 114 кв. м. (68 кв.м. - 1поверх, 48 кв.м - мансардний поверх.  Є літній другий поверх. Вхід з вулиці. На другому поверсі дві кімнати і коридор.  Будинок після реконструкції. Утеплений, замінено дах. Зроблено ремонт.  У будинку є санвузол.  Є газ. Працює газова колонка.  Елетроенергія.  Свердловина.  Каналізація.  Є всі документи на будинок і землю.  Велика ділянка. Земельна Ділянка - 23 соток. Приватизована. Для будівництва.  На ділянці є сарай.  Ціна 45 000 у.о..  #TerraUA : Місцева Агенція Нерухомості. Великий вибір Будинків у Вишеньках та Гнідині.",
			"images": 5,
			"location": "Вишенки, Киевская область, Бориспольский район\n                        \n                            Показать на карте"
	},
	"https://www.olx.ua/obyavlenie/prodam-dom-u-mihaylvka-rubezhvka-80-m-27-999u-e-sche-deshevshe-IDDlQUX.html#f7065a9d45": {
		"link": "https://www.olx.ua/obyavlenie/prodam-dom-u-mihaylvka-rubezhvka-80-m-27-999u-e-sche-deshevshe-IDDlQUX.html#f7065a9d45",
			"Объявление от": "Бизнес",
			"Выберите рубрику": "Продажа домов",
			"Без комиссии": "Без комиссии",
			"Возможность обмена": "",
			"Готов сотрудничать с риэлторами": "",
			"Расстояние до ближайшего города": "до 15 км.",
			"Этажность": "1",
			"Общая площадь": "80 м²",
			"Количество комнат": "4",
			"Площадь участка": "37 соток",
			"Тип дома": "Дом",
			"Год постройки / сдачи": "1960 - 1979",
			"Тип стен": "Кирпичный",
			"Тип кровли": "Шифер",
			"Санузел": "Смежный",
			"Отопление": "Индивидуальное газовое",
			"Ремонт": "Жилое состояние",
			"Меблирование": "Да",
			"Бытовая техника": "Холодильник\n\nВарочная панель\n\nПлита\n\nСтиральная машина",
			"Мультимедиа": "Кабельное\n\nцифровое ТВ\n\nСкоростной интернет",
			"Комфорт": "Беседка\n\nмангал\n\nПодсобные помещения\n\nЦоколь\n\nподвал\n\nВанна",
			"Коммуникации": "Асфальтированная дорога\n\nЭлектричество\n\nВывоз отходов\n\nГаз\n\nКанализация септик\n\nСкважина",
			"Инфраструктура (до 500 метров)": "Детский сад\n\nПарк\n\nзелёная зона\n\nДетская площадка\n\nШкола\n\nМагазин",
			"Ландшафт (до 1 км.)": "Лес\n\nОстрова\n\nОзеро\n\nГоры\n\nПарк\n\nРека",
			"price": "27 999 $",
			"description": "Объявление от    Бизнес         Выберите рубрику    Продажа домов           Без комиссии    Без комиссии         Возможность обмена               Готов сотрудничать с риэлторами             Расстояние до ближайшего города    до 15 км.           Этажность   1        Общая площадь   80 м²          Количество комнат   4        Площадь участка   37 соток          Тип дома    Дом         Год постройки / сдачи    1960 - 1979           Тип стен    Кирпичный         Тип кровли    Шифер           Санузел    Смежный         Отопление    Индивидуальное газовое           Ремонт    Жилое состояние         Меблирование    Да           Бытовая техника    Холодильник  Варочная панель  Плита  Стиральная машина         Мультимедиа    Кабельное  цифровое ТВ  Скоростной интернет           Комфорт    Беседка  мангал  Подсобные помещения  Цоколь  подвал  Ванна         Коммуникации    Асфальтированная дорога  Электричество  Вывоз отходов  Газ  Канализация септик  Скважина           Инфраструктура (до 500 метров)    Детский сад  Парк  зелёная зона  Детская площадка  Школа  Магазин         Ландшафт (до 1 км.)    Лес  Острова  Озеро  Горы  Парк  Река                                                                                          Продам   ДОМ.     Київської обл. с. Мих-Рубежівка ,, Другий Париж,,  Площа  земельної ділянки  37сот  (25сот –будинок ) ( 12сот –далі  на кінці земельної ділянки – є можливість купити  без 12 соток  і ціна буде ДЕШЕВШОЮ ) )– Загальна ціна  28 000у.е. А якщо Вам потрібний будинок і земі менше  , то приїжджайте , будемо проводити перемовини . Метраж  будинка  80м.кв , 4 кімнати  , зручності у будинку , підвал ,  2 сара  і гараж ,  комунікації –септік , водопостачання –колодязь ,   газовий котел , електропостачання  . Будинок придатний для життя  і для забудови    , будинок знаходиться по вул. Шевченка  ,недалеко  від  центра , асфальтний під’їзд  , поруч магазини  першої необхідності .  До Київа  30 хв на авто , ліс, природа , чисте повітря , гриби та ягоди , риболовля та мандрівка  із сімєю . Купуйте будинок  під Київом , працюйте  у Києві , плануйте фундамент здорової сімї – біля природи .",
			"images": 5,
			"location": "Киев, Киевская область, Святошинский\n                        \n                            Показать на карте"
	},
	"https://www.olx.ua/obyavlenie/prodazha-kirpichnogo-kapitalnogo-doma-na-10-sotkah-IDB8rE0.html#f7065a9d45": {
		"link": "https://www.olx.ua/obyavlenie/prodazha-kirpichnogo-kapitalnogo-doma-na-10-sotkah-IDB8rE0.html#f7065a9d45",
			"Объявление от": "Бизнес",
			"Выберите рубрику": "Продажа домов",
			"Расстояние до ближайшего города": "В городе",
			"Этажность": "1",
			"Общая площадь": "95 м²",
			"Количество комнат": "5",
			"Площадь участка": "10 соток",
			"Тип дома": "Дом",
			"Год постройки / сдачи": "1990 - 2000",
			"Тип стен": "Кирпичный",
			"Тип кровли": "Шифер",
			"Санузел": "Смежный",
			"Отопление": "Индивидуальное газовое",
			"Ремонт": "Косметический ремонт",
			"Бытовая техника": "Плита",
			"Инфраструктура (до 500 метров)": "Детский сад\n\nШкола\n\nОстановка транспорта",
			"Ландшафт (до 1 км.)": "Река",
			"price": "45 000 $",
			"description": "Объявление от    Бизнес         Выберите рубрику    Продажа домов           Расстояние до ближайшего города    В городе         Этажность   1          Общая площадь   95 м²        Количество комнат   5          Площадь участка   10 соток        Тип дома    Дом           Год постройки / сдачи    1990 - 2000         Тип стен    Кирпичный           Тип кровли    Шифер         Санузел    Смежный           Отопление    Индивидуальное газовое         Ремонт    Косметический ремонт           Бытовая техника    Плита         Инфраструктура (до 500 метров)    Детский сад  Школа  Остановка транспорта           Ландшафт (до 1 км.)    Река                                                                                            Дом кирпичный в хорошем рн.Капитальная стройка,хорошое состояние,окна мп,кухня 14 кв,су большой,3 раздельные комнаты и 2 проходные.",
			"images": 5,
			"location": "Буча, Киевская область                            Посмотреть на карте"
	},
	"https://www.olx.ua/obyavlenie/prodam-dom-osokorki-metro-slavutich-IDEvXWm.html#f7065a9d45": {
		"link": "https://www.olx.ua/obyavlenie/prodam-dom-osokorki-metro-slavutich-IDEvXWm.html#f7065a9d45",
			"Объявление от": "Бизнес",
			"Выберите рубрику": "Продажа домов",
			"Без комиссии": "",
			"Возможность обмена": "",
			"Готов сотрудничать с риэлторами": "",
			"Этажность": "2",
			"Общая площадь": "112 м²",
			"Количество комнат": "5",
			"Площадь участка": "10 соток",
			"Тип дома": "Дом",
			"Ландшафт (до 1 км.)": "Озеро\n\nРека",
			"price": "60 000 $",
			"description": "Объявление от    Бизнес         Выберите рубрику    Продажа домов           Без комиссии             Возможность обмена               Готов сотрудничать с риэлторами             Этажность   2          Общая площадь   112 м²        Количество комнат   5          Площадь участка   10 соток        Тип дома    Дом           Ландшафт (до 1 км.)    Озеро  Река                                                                                            Продаётся дом  Осокорки на ул Садовая и угол Святищенской . Шикарный , ровный , прямоугольный один из лучших участков10 соток( у других по 6 соток) .  Дом кирпичный  2 этажа .Общая площадь дома 112 кв.м., жилая 85 кв.м. На участке  много фруктовых деревьев, сад. От метро Славутич 6  км, ходят маршрутки, автобус; до Днепра и пляжа 10 минут пешком, рядом коттеджи, супермаркет , остановки .Ограждения территория . 60000 дол",
			"images": 5,
			"location": "Киев, Киевская область, Дарницкий\n                        \n                            Показать на карте"
	},
	"https://www.olx.ua/obyavlenie/dom-gorenichi-15-sotok-u-lesa-IDsOwue.html#f7065a9d45": {
		"link": "https://www.olx.ua/obyavlenie/dom-gorenichi-15-sotok-u-lesa-IDsOwue.html#f7065a9d45",
			"Объявление от": "Частного лица",
			"Выберите рубрику": "Продажа домов",
			"Без комиссии": "",
			"Возможность обмена": "",
			"Готов сотрудничать с риэлторами": "",
			"Расстояние до ближайшего города": "до 5 км.",
			"Этажность": "2",
			"Общая площадь": "210 м²",
			"Количество комнат": "7",
			"Площадь участка": "15 соток",
			"Тип дома": "Дом",
			"Коммуникации": "Электричество\n\nВывоз отходов\n\nГаз",
			"Ландшафт (до 1 км.)": "Лес\n\nОзеро",
			"price": "70 000 $",
			"description": "Объявление от    Частного лица         Выберите рубрику    Продажа домов           Без комиссии             Возможность обмена               Готов сотрудничать с риэлторами             Расстояние до ближайшего города    до 5 км.           Этажность   2        Общая площадь   210 м²          Количество комнат   7        Площадь участка   15 соток          Тип дома    Дом         Коммуникации    Электричество  Вывоз отходов  Газ           Ландшафт (до 1 км.)    Лес  Озеро                                                                                            Дом в живописном месте, первая линия от соснового леса, рядом каскад озер, участок с тыльной и торцевой стороны огражден капитальным забором, асфальт.  Общей площадью 210кв.м, материал постройки газобетон+утеплитель+дек.штукатурка, фасад дома полностью готов, стеклопакеты, внутри дом без отделки. Функциональная планировка, гостинная с камином и выходом на терассу, на втором этаже свободная планировка и два балкона. Газ электричество на участке.",
			"images": 5,
			"location": "Гореничи, Киевская область, Киево-Святошинский район\n                        \n                            Показать на карте"
	},
	"https://www.olx.ua/obyavlenie/dom-gorenichi-15-sotok-u-lesa-IDsOwue.html#f7065a9d45;promoted": {
		"link": "https://www.olx.ua/obyavlenie/dom-gorenichi-15-sotok-u-lesa-IDsOwue.html#f7065a9d45;promoted",
			"Объявление от": "Частного лица",
			"Выберите рубрику": "Продажа домов",
			"Без комиссии": "",
			"Возможность обмена": "",
			"Готов сотрудничать с риэлторами": "",
			"Расстояние до ближайшего города": "до 5 км.",
			"Этажность": "2",
			"Общая площадь": "210 м²",
			"Количество комнат": "7",
			"Площадь участка": "15 соток",
			"Тип дома": "Дом",
			"Коммуникации": "Электричество\n\nВывоз отходов\n\nГаз",
			"Ландшафт (до 1 км.)": "Лес\n\nОзеро",
			"price": "70 000 $",
			"description": "Объявление от    Частного лица         Выберите рубрику    Продажа домов           Без комиссии             Возможность обмена               Готов сотрудничать с риэлторами             Расстояние до ближайшего города    до 5 км.           Этажность   2        Общая площадь   210 м²          Количество комнат   7        Площадь участка   15 соток          Тип дома    Дом         Коммуникации    Электричество  Вывоз отходов  Газ           Ландшафт (до 1 км.)    Лес  Озеро                                                                                            Дом в живописном месте, первая линия от соснового леса, рядом каскад озер, участок с тыльной и торцевой стороны огражден капитальным забором, асфальт.  Общей площадью 210кв.м, материал постройки газобетон+утеплитель+дек.штукатурка, фасад дома полностью готов, стеклопакеты, внутри дом без отделки. Функциональная планировка, гостинная с камином и выходом на терассу, на втором этаже свободная планировка и два балкона. Газ электричество на участке.",
			"images": 5,
			"location": "Гореничи, Киевская область, Киево-Святошинский район\n                        \n                            Показать на карте"
	},
	"https://www.olx.ua/obyavlenie/dom-120m2-s-yurovka-vita-pochtovaya-uchastok-12-sotok-IDEsU0s.html#f7065a9d45": {
		"link": "https://www.olx.ua/obyavlenie/dom-120m2-s-yurovka-vita-pochtovaya-uchastok-12-sotok-IDEsU0s.html#f7065a9d45",
			"Объявление от": "Бизнес",
			"Выберите рубрику": "Продажа домов",
			"Без комиссии": "",
			"Возможность обмена": "",
			"Готов сотрудничать с риэлторами": "Готов сотрудничать с риэлторами",
			"Этажность": "2",
			"Общая площадь": "120 м²",
			"Количество комнат": "3",
			"Площадь участка": "12 соток",
			"Тип дома": "Дача",
			"price": "31 000 $",
			"description": "Объявление от    Бизнес         Выберите рубрику    Продажа домов           Без комиссии             Возможность обмена               Готов сотрудничать с риэлторами    Готов сотрудничать с риэлторами         Этажность   2          Общая площадь   120 м²        Количество комнат   3          Площадь участка   12 соток        Тип дома    Дача                                                                                          Киево-Святошинский р-н, с.Юровка, кооператив Березка - 5, просторный дом в сосновом лесу 160 м2, пригоден для круглогодичного проживания, подключены газ, электричество. В доме есть газовый котел, печь, подключены и функционируют все коммуникации, есть гараж на два машиноместа, большой угловой участок (12 соток) с возможностью деления его на два и постройки еще одного дома, фруктовый сад, рядом живописный сосновый лес, озеро, магазин, остановка общественного транспорта, Киев 10 км.",
			"images": 5,
			"location": "Юровка, Киевская область, Киево-Святошинский район                            Посмотреть на карте"
	},
	"https://www.olx.ua/obyavlenie/prodam-dom-kievo-svyatoshinskiy-rayon-bucha-mirotskoe-chastnik-IDzxhtM.html#f7065a9d45": {
		"link": "https://www.olx.ua/obyavlenie/prodam-dom-kievo-svyatoshinskiy-rayon-bucha-mirotskoe-chastnik-IDzxhtM.html#f7065a9d45",
			"Объявление от": "Частного лица",
			"Выберите рубрику": "Продажа домов",
			"Готов сотрудничать с риэлторами": "Готов сотрудничать с риэлторами",
			"Этажность": "2",
			"Общая площадь": "173 м²",
			"Количество комнат": "6",
			"Площадь участка": "18 соток",
			"Тип дома": "Коттедж",
			"Тип стен": "Газоблок",
			"Внешнее утепление стен": "Пенопласт",
			"Тип кровли": "Металлочерепица",
			"Санузел": "Смежный",
			"Отопление": "Индивидуальное газовое",
			"Ремонт": "Авторский проект",
			"Меблирование": "Да",
			"Мультимедиа": "Wi-Fi\n\nСкоростной интернет\n\nКабельное",
			"Комфорт": "Подогрев пола\n\nДушевая кабина\n\nБалкон\n\nЗабор",
			"Коммуникации": "Газ\n\nСкважина\n\nЭлектричество\n\nКанализация септик\n\nВывоз отходов\n\nАсфальтированная дорога",
			"Инфраструктура (до 500 метров)": "Детский сад\n\nШкола\n\nОстановка транспорта\n\nМагазин\n\nкиоск\n\nДетская площадка\n\nАптека",
			"Ландшафт (до 1 км.)": "Озеро\n\nЛес",
			"price": "56 000 $",
			"description": "Объявление от    Частного лица         Выберите рубрику    Продажа домов           Готов сотрудничать с риэлторами    Готов сотрудничать с риэлторами         Этажность   2          Общая площадь   173 м²        Количество комнат   6          Площадь участка   18 соток        Тип дома    Коттедж           Тип стен    Газоблок         Внешнее утепление стен    Пенопласт           Тип кровли    Металлочерепица         Санузел    Смежный           Отопление    Индивидуальное газовое         Ремонт    Авторский проект           Меблирование    Да         Мультимедиа    Wi-Fi  Скоростной интернет  Кабельное           Комфорт    Подогрев пола  Душевая кабина  Балкон  Забор         Коммуникации    Газ  Скважина  Электричество  Канализация септик  Вывоз отходов  Асфальтированная дорога           Инфраструктура (до 500 метров)    Детский сад  Школа  Остановка транспорта  Магазин  киоск  Детская площадка  Аптека         Ландшафт (до 1 км.)    Озеро  Лес                                                                                          ЦЕНА АКТУАЛЬНА ДО КОНЦА МЕСЯЦА!!! Продам дом в селе Мироцкое Киево-Святошинский район.Село Мироцкое вошло в состав города Буча в начале 2016 года. Дом двухэтажный, второй мансардный. Общая площадь дома 173 м2. На всём первом этаже тёплый пол, газовое отопление, двухконтурный котел, сделан ремонт, заходи и живи. Второй этаж без отделки, его можно сделать как для жилья, так и для отдыха. Участок 18 соток, на участке погреб, временный деревянный сарай, колодец, скважина 70 м от которой подведена вода в дом. На участке есть все газ, свет, вода, канализация. Возле дома проходит асфальтированная дорога. В пешей доступности детский садик, школа, и 4 озера для отдыха. Варшавская трасса от дома 1200 метров. Расстояние от Киева до Мироцкого 23 км по Варшавской трассе. Потенциальным покупателям могу скинуть в личку фото расположение комнат и интерьера. За более подробной информацией звоните.",
			"images": 5,
			"location": "Буча, Киевская область\n                        \n                            Показать на карте"
	},
	"https://www.olx.ua/obyavlenie/prodam-dom-kievo-svyatoshinskiy-rayon-bucha-mirotskoe-chastnik-IDzxhtM.html#f7065a9d45;promoted": {
		"link": "https://www.olx.ua/obyavlenie/prodam-dom-kievo-svyatoshinskiy-rayon-bucha-mirotskoe-chastnik-IDzxhtM.html#f7065a9d45;promoted",
			"Объявление от": "Частного лица",
			"Выберите рубрику": "Продажа домов",
			"Готов сотрудничать с риэлторами": "Готов сотрудничать с риэлторами",
			"Этажность": "2",
			"Общая площадь": "173 м²",
			"Количество комнат": "6",
			"Площадь участка": "18 соток",
			"Тип дома": "Коттедж",
			"Тип стен": "Газоблок",
			"Внешнее утепление стен": "Пенопласт",
			"Тип кровли": "Металлочерепица",
			"Санузел": "Смежный",
			"Отопление": "Индивидуальное газовое",
			"Ремонт": "Авторский проект",
			"Меблирование": "Да",
			"Мультимедиа": "Wi-Fi\n\nСкоростной интернет\n\nКабельное",
			"Комфорт": "Подогрев пола\n\nДушевая кабина\n\nБалкон\n\nЗабор",
			"Коммуникации": "Газ\n\nСкважина\n\nЭлектричество\n\nКанализация септик\n\nВывоз отходов\n\nАсфальтированная дорога",
			"Инфраструктура (до 500 метров)": "Детский сад\n\nШкола\n\nОстановка транспорта\n\nМагазин\n\nкиоск\n\nДетская площадка\n\nАптека",
			"Ландшафт (до 1 км.)": "Озеро\n\nЛес",
			"price": "56 000 $",
			"description": "Объявление от    Частного лица         Выберите рубрику    Продажа домов           Готов сотрудничать с риэлторами    Готов сотрудничать с риэлторами         Этажность   2          Общая площадь   173 м²        Количество комнат   6          Площадь участка   18 соток        Тип дома    Коттедж           Тип стен    Газоблок         Внешнее утепление стен    Пенопласт           Тип кровли    Металлочерепица         Санузел    Смежный           Отопление    Индивидуальное газовое         Ремонт    Авторский проект           Меблирование    Да         Мультимедиа    Wi-Fi  Скоростной интернет  Кабельное           Комфорт    Подогрев пола  Душевая кабина  Балкон  Забор         Коммуникации    Газ  Скважина  Электричество  Канализация септик  Вывоз отходов  Асфальтированная дорога           Инфраструктура (до 500 метров)    Детский сад  Школа  Остановка транспорта  Магазин  киоск  Детская площадка  Аптека         Ландшафт (до 1 км.)    Озеро  Лес                                                                                          ЦЕНА АКТУАЛЬНА ДО КОНЦА МЕСЯЦА!!! Продам дом в селе Мироцкое Киево-Святошинский район.Село Мироцкое вошло в состав города Буча в начале 2016 года. Дом двухэтажный, второй мансардный. Общая площадь дома 173 м2. На всём первом этаже тёплый пол, газовое отопление, двухконтурный котел, сделан ремонт, заходи и живи. Второй этаж без отделки, его можно сделать как для жилья, так и для отдыха. Участок 18 соток, на участке погреб, временный деревянный сарай, колодец, скважина 70 м от которой подведена вода в дом. На участке есть все газ, свет, вода, канализация. Возле дома проходит асфальтированная дорога. В пешей доступности детский садик, школа, и 4 озера для отдыха. Варшавская трасса от дома 1200 метров. Расстояние от Киева до Мироцкого 23 км по Варшавской трассе. Потенциальным покупателям могу скинуть в личку фото расположение комнат и интерьера. За более подробной информацией звоните.",
			"images": 5,
			"location": "Буча, Киевская область\n                        \n                            Показать на карте"
	},
	"https://www.olx.ua/obyavlenie/srochno-po-tsene-zemli-dom-200m-25-sotok-vishenki-zoloche-osokorki-gnedin-IDDXdNS.html#f7065a9d45": {
		"link": "https://www.olx.ua/obyavlenie/srochno-po-tsene-zemli-dom-200m-25-sotok-vishenki-zoloche-osokorki-gnedin-IDDXdNS.html#f7065a9d45",
			"Объявление от": "Частного лица",
			"Выберите рубрику": "Продажа домов",
			"Без комиссии": "Без комиссии",
			"Возможность обмена": "Возможность обмена",
			"Готов сотрудничать с риэлторами": "Готов сотрудничать с риэлторами",
			"Расстояние до ближайшего города": "до 15 км.",
			"Этажность": "2",
			"Общая площадь": "200 м²",
			"Количество комнат": "6",
			"Площадь участка": "25 соток",
			"Тип дома": "Дом",
			"Год постройки / сдачи": "2001 - 2010",
			"Тип стен": "Газоблок",
			"Тип кровли": "Металлошифер",
			"Санузел": "2 и более",
			"Отопление": "Индивидуальное газовое",
			"Ремонт": "После строителей",
			"Мультимедиа": "Скоростной интернет",
			"Коммуникации": "Асфальтированная дорога\n\nЭлектричество\n\nВывоз отходов\n\nГаз\n\nКанализация септик\n\nСкважина",
			"Инфраструктура (до 500 метров)": "Аптека\n\nБольница\n\nполиклиника\n\nДетский сад\n\nРынок\n\nПарк\n\nзелёная зона\n\nДетская площадка\n\nОтделение почты\n\nРесторан\n\nкафе",
			"Ландшафт (до 1 км.)": "Лес\n\nХолмы\n\nОзеро\n\nРека",
			"price": "34 750 $",
			"description": "Объявление от    Частного лица         Выберите рубрику    Продажа домов           Без комиссии    Без комиссии         Возможность обмена    Возможность обмена           Готов сотрудничать с риэлторами    Готов сотрудничать с риэлторами         Расстояние до ближайшего города    до 15 км.           Этажность   2        Общая площадь   200 м²          Количество комнат   6        Площадь участка   25 соток          Тип дома    Дом         Год постройки / сдачи    2001 - 2010           Тип стен    Газоблок         Тип кровли    Металлошифер           Санузел    2 и более         Отопление    Индивидуальное газовое           Ремонт    После строителей         Мультимедиа    Скоростной интернет           Коммуникации    Асфальтированная дорога  Электричество  Вывоз отходов  Газ  Канализация септик  Скважина         Инфраструктура (до 500 метров)    Аптека  Больница  поликлиника  Детский сад  Рынок  Парк  зелёная зона  Детская площадка  Отделение почты  Ресторан  кафе           Ландшафт (до 1 км.)    Лес  Холмы  Озеро  Река                                                                                            Практичным и дальновидным хозяйственникам предлагается перспективное хозяйство, включающее в себя: участок 25 соток земли правильной прямоугольной формы огороженный по всему периметру бетонным забором 2,5 м, дом 10*14 в 2х уровнях, требующий доработки, гараж, мастерская, большой 2к погреб, 4 хозпостройки (сараи для хозяйственных нужд и содержания животных), вольер для собаки. Дом подключён ко всем коммуникациям: электричество, газ, интернет (оптоволокно), 2 септика. Ранее дом был жилым на 2-х хозяев с газовым отоплением. Изначально был меньших размеров, потом в 2005 г был достроен в длину и высоту по проекту газоблоком, заменена крыша на металлошифер. Была попытка переделки и изменения планировки под одного хозяина, но из-за нехватки времени не была закончена, поэтому последние 2 года дом используется как дача с 2мя жилыми комнатами. Если приложить усилия и умелые руки из этой коробки можно организовать неплохой семейный особняк. На данный момент это устоявшаяся 2х этажная коробка на крепком фундаменте с идеальной крышей (особенно для \"зеленошго тарифа\" ), в которой можно организовать 3-й мансардный этаж. Во дворе туи и большая оттерассированная фундаментом клумба с цветами. На участке есть большой сад с яблонями, абрикосами, орехами, сливами, алычой, персиком, виноградом, кизилом, ягодными кустами.  На участке есть: 4 скважины (2 из них в доме), колодец, 2 теплицы, парник летний душ и туалет. От дома в двухстах метрах - остановка автобуса и магазин. В 500 метрах от участка – самый большой и элитный коттеджный городок в Украине – «Золоче» с British School, Rangers park, Resort & Spa и с ценой земли от 5000$ сотка. До Киева 15 км. Вишенки – перспективное большое село с развитой инфраструктурой – большая школа, детские сады, амбулатория, почта, Новая Почта, продовольственные и хозяйственные промтоварные магазины, спортивная площадка, стадион, парк, ресторан, кафе, клуб. Из центра села каждые 15-20 минут ходят маршрутки до метро Харьковская, время в дороге 25 мин. До Киева добраться можно двумя хорошими дорогами – через канал Золоче-нижние Осокорки до ст. метро Славутич и Южного Моста или через Гнедин – Бортничи до ст. метро Бориспольская – в обоих случаях – 15 км до въезда в Киев. В окружении села Вишенки – девственные леса, чистые озера, озеро и канал Золоче с клёвой рыбалкой (настоящие рыбаки – знают). Вишенки - экологически чистое, живописное место– идеально для спокойной жизни и отдыха и в максимальной близости и транспортной доступности к Киеву с его самой развитой инфраструктурой и высокооплачиваемой работой. И всё это – фактически по цене земли, которая здесь будет только дорожать. Предложение – для думающих хозяйственных людей, которые ценят перспективность, выгодность и могут оценить истинную себестоимость этого объекта, а также его выгодность для последующего постоянного проживания или для продажи после улучшения. Цену снизил уже до стоимости земли.",
			"images": 5,
			"location": "Вишенки, Киевская область, Бориспольский район\n                        \n                            Показать на карте"
	},
	"https://www.olx.ua/obyavlenie/srochno-po-tsene-zemli-dom-200m-25-sotok-vishenki-zoloche-osokorki-gnedin-IDDXdNS.html#f7065a9d45;promoted": {
		"link": "https://www.olx.ua/obyavlenie/srochno-po-tsene-zemli-dom-200m-25-sotok-vishenki-zoloche-osokorki-gnedin-IDDXdNS.html#f7065a9d45;promoted",
			"Объявление от": "Частного лица",
			"Выберите рубрику": "Продажа домов",
			"Без комиссии": "Без комиссии",
			"Возможность обмена": "Возможность обмена",
			"Готов сотрудничать с риэлторами": "Готов сотрудничать с риэлторами",
			"Расстояние до ближайшего города": "до 15 км.",
			"Этажность": "2",
			"Общая площадь": "200 м²",
			"Количество комнат": "6",
			"Площадь участка": "25 соток",
			"Тип дома": "Дом",
			"Год постройки / сдачи": "2001 - 2010",
			"Тип стен": "Газоблок",
			"Тип кровли": "Металлошифер",
			"Санузел": "2 и более",
			"Отопление": "Индивидуальное газовое",
			"Ремонт": "После строителей",
			"Мультимедиа": "Скоростной интернет",
			"Коммуникации": "Асфальтированная дорога\n\nЭлектричество\n\nВывоз отходов\n\nГаз\n\nКанализация септик\n\nСкважина",
			"Инфраструктура (до 500 метров)": "Аптека\n\nБольница\n\nполиклиника\n\nДетский сад\n\nРынок\n\nПарк\n\nзелёная зона\n\nДетская площадка\n\nОтделение почты\n\nРесторан\n\nкафе",
			"Ландшафт (до 1 км.)": "Лес\n\nХолмы\n\nОзеро\n\nРека",
			"price": "34 750 $",
			"description": "Объявление от    Частного лица         Выберите рубрику    Продажа домов           Без комиссии    Без комиссии         Возможность обмена    Возможность обмена           Готов сотрудничать с риэлторами    Готов сотрудничать с риэлторами         Расстояние до ближайшего города    до 15 км.           Этажность   2        Общая площадь   200 м²          Количество комнат   6        Площадь участка   25 соток          Тип дома    Дом         Год постройки / сдачи    2001 - 2010           Тип стен    Газоблок         Тип кровли    Металлошифер           Санузел    2 и более         Отопление    Индивидуальное газовое           Ремонт    После строителей         Мультимедиа    Скоростной интернет           Коммуникации    Асфальтированная дорога  Электричество  Вывоз отходов  Газ  Канализация септик  Скважина         Инфраструктура (до 500 метров)    Аптека  Больница  поликлиника  Детский сад  Рынок  Парк  зелёная зона  Детская площадка  Отделение почты  Ресторан  кафе           Ландшафт (до 1 км.)    Лес  Холмы  Озеро  Река                                                                                            Практичным и дальновидным хозяйственникам предлагается перспективное хозяйство, включающее в себя: участок 25 соток земли правильной прямоугольной формы огороженный по всему периметру бетонным забором 2,5 м, дом 10*14 в 2х уровнях, требующий доработки, гараж, мастерская, большой 2к погреб, 4 хозпостройки (сараи для хозяйственных нужд и содержания животных), вольер для собаки. Дом подключён ко всем коммуникациям: электричество, газ, интернет (оптоволокно), 2 септика. Ранее дом был жилым на 2-х хозяев с газовым отоплением. Изначально был меньших размеров, потом в 2005 г был достроен в длину и высоту по проекту газоблоком, заменена крыша на металлошифер. Была попытка переделки и изменения планировки под одного хозяина, но из-за нехватки времени не была закончена, поэтому последние 2 года дом используется как дача с 2мя жилыми комнатами. Если приложить усилия и умелые руки из этой коробки можно организовать неплохой семейный особняк. На данный момент это устоявшаяся 2х этажная коробка на крепком фундаменте с идеальной крышей (особенно для \"зеленошго тарифа\" ), в которой можно организовать 3-й мансардный этаж. Во дворе туи и большая оттерассированная фундаментом клумба с цветами. На участке есть большой сад с яблонями, абрикосами, орехами, сливами, алычой, персиком, виноградом, кизилом, ягодными кустами.  На участке есть: 4 скважины (2 из них в доме), колодец, 2 теплицы, парник летний душ и туалет. От дома в двухстах метрах - остановка автобуса и магазин. В 500 метрах от участка – самый большой и элитный коттеджный городок в Украине – «Золоче» с British School, Rangers park, Resort & Spa и с ценой земли от 5000$ сотка. До Киева 15 км. Вишенки – перспективное большое село с развитой инфраструктурой – большая школа, детские сады, амбулатория, почта, Новая Почта, продовольственные и хозяйственные промтоварные магазины, спортивная площадка, стадион, парк, ресторан, кафе, клуб. Из центра села каждые 15-20 минут ходят маршрутки до метро Харьковская, время в дороге 25 мин. До Киева добраться можно двумя хорошими дорогами – через канал Золоче-нижние Осокорки до ст. метро Славутич и Южного Моста или через Гнедин – Бортничи до ст. метро Бориспольская – в обоих случаях – 15 км до въезда в Киев. В окружении села Вишенки – девственные леса, чистые озера, озеро и канал Золоче с клёвой рыбалкой (настоящие рыбаки – знают). Вишенки - экологически чистое, живописное место– идеально для спокойной жизни и отдыха и в максимальной близости и транспортной доступности к Киеву с его самой развитой инфраструктурой и высокооплачиваемой работой. И всё это – фактически по цене земли, которая здесь будет только дорожать. Предложение – для думающих хозяйственных людей, которые ценят перспективность, выгодность и могут оценить истинную себестоимость этого объекта, а также его выгодность для последующего постоянного проживания или для продажи после улучшения. Цену снизил уже до стоимости земли.",
			"images": 5,
			"location": "Вишенки, Киевская область, Бориспольский район\n                        \n                            Показать на карте"
	},
	"https://www.olx.ua/obyavlenie/gotovyy-dupleks-v-irpene-IDEsShU.html#f7065a9d45": {
		"link": "https://www.olx.ua/obyavlenie/gotovyy-dupleks-v-irpene-IDEsShU.html#f7065a9d45",
			"Объявление от": "Бизнес",
			"Выберите рубрику": "Продажа домов",
			"Без комиссии": "Без комиссии",
			"Этажность": "2",
			"Общая площадь": "105 м²",
			"Количество комнат": "4",
			"Площадь участка": "300 соток",
			"Тип дома": "Дом",
			"Санузел": "2 и более",
			"Отопление": "Индивидуальное газовое",
			"Ремонт": "Под чистовую отделку",
			"price": "75 000 $",
			"description": "Объявление от    Бизнес         Выберите рубрику    Продажа домов           Без комиссии    Без комиссии         Этажность   2          Общая площадь   105 м²        Количество комнат   4          Площадь участка   300 соток        Тип дома    Дом           Санузел    2 и более         Отопление    Индивидуальное газовое           Ремонт    Под чистовую отделку                                                                                            Продам отличный дуплекс в Ирпене по ул. Варшавской.   Общая площадь 105 кв.м., жилая 42 кв.м., кухня 28 кв.м., 3,1 сот. земли.  Дуплекс подготовлен под ремонт: чистовая штукатурка стен, стяжка пола, м/п окна (5-ти камерные стекло-пакеты), автономное газовое отопление (2-х контурный котел), теплый пол, разведено отопление под радиаторы, разведена электрика по дому.  Стоимость 75 000 у.е.   Без комиссии.   Более подробно по телефону, с Уважением Светлана.  Компанія: АН Партнер",
			"images": 5,
			"location": "Ирпень, Киевская область                            Посмотреть на карте"
	},
	"https://www.olx.ua/obyavlenie/prodazha-doma-v-s-lesniki-kievo-svyatoshinskiy-rayon-g-kiev-IDzResV.html#f7065a9d45": {
		"link": "https://www.olx.ua/obyavlenie/prodazha-doma-v-s-lesniki-kievo-svyatoshinskiy-rayon-g-kiev-IDzResV.html#f7065a9d45",
			"Объявление от": "Частного лица",
			"Выберите рубрику": "Продажа домов",
			"Без комиссии": "",
			"Возможность обмена": "",
			"Готов сотрудничать с риэлторами": "",
			"Этажность": "2",
			"Общая площадь": "180 м²",
			"Количество комнат": "4",
			"Площадь участка": "15 соток",
			"Тип дома": "Дом",
			"price": "32 000 $",
			"description": "Объявление от    Частного лица         Выберите рубрику    Продажа домов           Без комиссии             Возможность обмена               Готов сотрудничать с риэлторами             Этажность   2          Общая площадь   180 м²        Количество комнат   4          Площадь участка   15 соток        Тип дома    Дом                                                                                          Продатся дом, кирпичный. 5 км.от Киева по Ново-Обуховской трассе, с.Лесники.  Площадь дома 180 м.кв. Площадь участка 14,22 сотки.  Без комиссии.",
			"images": 5,
			"location": "Лесники, Киевская область, Киево-Святошинский район\n                        \n                            Показать на карте"
	},
	"https://www.olx.ua/obyavlenie/prodazha-doma-v-s-lesniki-kievo-svyatoshinskiy-rayon-g-kiev-IDzResV.html#f7065a9d45;promoted": {
		"link": "https://www.olx.ua/obyavlenie/prodazha-doma-v-s-lesniki-kievo-svyatoshinskiy-rayon-g-kiev-IDzResV.html#f7065a9d45;promoted",
			"Объявление от": "Частного лица",
			"Выберите рубрику": "Продажа домов",
			"Без комиссии": "",
			"Возможность обмена": "",
			"Готов сотрудничать с риэлторами": "",
			"Этажность": "2",
			"Общая площадь": "180 м²",
			"Количество комнат": "4",
			"Площадь участка": "15 соток",
			"Тип дома": "Дом",
			"price": "32 000 $",
			"description": "Объявление от    Частного лица         Выберите рубрику    Продажа домов           Без комиссии             Возможность обмена               Готов сотрудничать с риэлторами             Этажность   2          Общая площадь   180 м²        Количество комнат   4          Площадь участка   15 соток        Тип дома    Дом                                                                                          Продатся дом, кирпичный. 5 км.от Киева по Ново-Обуховской трассе, с.Лесники.  Площадь дома 180 м.кв. Площадь участка 14,22 сотки.  Без комиссии.",
			"images": 5,
			"location": "Лесники, Киевская область, Киево-Святошинский район\n                        \n                            Показать на карте"
	},
	"https://www.olx.ua/obyavlenie/dom-v-zhivopisnom-meste-hozyain-IDzYuJs.html#f7065a9d45": {
		"link": "https://www.olx.ua/obyavlenie/dom-v-zhivopisnom-meste-hozyain-IDzYuJs.html#f7065a9d45",
			"Объявление от": "Частного лица",
			"Выберите рубрику": "Продажа домов",
			"Без комиссии": "Без комиссии",
			"Возможность обмена": "",
			"Готов сотрудничать с риэлторами": "Готов сотрудничать с риэлторами",
			"Расстояние до ближайшего города": "до 15 км.",
			"Этажность": "1",
			"Общая площадь": "130 м²",
			"Количество комнат": "6",
			"Площадь участка": "10 соток",
			"Тип дома": "Дом",
			"Год постройки / сдачи": "Не этапе строительства",
			"Тип стен": "Газоблок",
			"Внешнее утепление стен": "Минеральная вата",
			"Тип кровли": "Металлочерепица",
			"Санузел": "2 и более",
			"Отопление": "Собственная котельная",
			"Коммуникации": "Асфальтированная дорога\n\nЭлектричество\n\nКанализация септик\n\nСкважина",
			"Инфраструктура (до 500 метров)": "Отделение банка\n\nбанкомат\n\nАптека\n\nБольница\n\nполиклиника\n\nРынок\n\nПарк\n\nзелёная зона\n\nДетская площадка",
			"Ландшафт (до 1 км.)": "Холмы\n\nОзеро\n\nГоры\n\nПарк",
			"price": "60 000 $",
			"description": "Объявление от    Частного лица         Выберите рубрику    Продажа домов           Без комиссии    Без комиссии         Возможность обмена               Готов сотрудничать с риэлторами    Готов сотрудничать с риэлторами         Расстояние до ближайшего города    до 15 км.           Этажность   1        Общая площадь   130 м²          Количество комнат   6        Площадь участка   10 соток          Тип дома    Дом         Год постройки / сдачи    Не этапе строительства           Тип стен    Газоблок         Внешнее утепление стен    Минеральная вата           Тип кровли    Металлочерепица         Санузел    2 и более           Отопление    Собственная котельная         Коммуникации    Асфальтированная дорога  Электричество  Канализация септик  Скважина           Инфраструктура (до 500 метров)    Отделение банка  банкомат  Аптека  Больница  поликлиника  Рынок  Парк  зелёная зона  Детская площадка         Ландшафт (до 1 км.)    Холмы  Озеро  Горы  Парк                                                                                          Дом с шикарным видом на березовую рощу в с.Рославичи, Васильковского района. Расположен на участке 10 соток.  Общая площадь дома - 130 кв.м. (первый этаж - 95 кв.м., мансардный этаж - 35 кв.м.).  Живописная местность, за которую Рославичи называют «Васильковскими Карпатами».  Отличная транспортная развязка.  Дом находится в окружении красивой природы, рядом озеро, детская площадка, церковь, магазин.  К дому уже подведен свет! Сейчас делаются отмостки, канализация(септик),скважина,забор,после этих работ : окна, двери, фасады,будет сделан нормальный подьезд, водостоки и черновые полы... + участок 10 соток. За более подробной информацией обращайтесь по указанным контактам.  ХОЗЯИН. Цена -  от 60 000 у.е. Смотрите другие мои объявления!",
			"images": 5,
			"location": "Рославичи, Киевская область, Васильковский район\n                        \n                            Показать на карте"
	},
	"https://www.olx.ua/obyavlenie/dom-v-zhivopisnom-meste-hozyain-IDzYuJs.html#f7065a9d45;promoted": {
		"link": "https://www.olx.ua/obyavlenie/dom-v-zhivopisnom-meste-hozyain-IDzYuJs.html#f7065a9d45;promoted",
			"Объявление от": "Частного лица",
			"Выберите рубрику": "Продажа домов",
			"Без комиссии": "Без комиссии",
			"Возможность обмена": "",
			"Готов сотрудничать с риэлторами": "Готов сотрудничать с риэлторами",
			"Расстояние до ближайшего города": "до 15 км.",
			"Этажность": "1",
			"Общая площадь": "130 м²",
			"Количество комнат": "6",
			"Площадь участка": "10 соток",
			"Тип дома": "Дом",
			"Год постройки / сдачи": "Не этапе строительства",
			"Тип стен": "Газоблок",
			"Внешнее утепление стен": "Минеральная вата",
			"Тип кровли": "Металлочерепица",
			"Санузел": "2 и более",
			"Отопление": "Собственная котельная",
			"Коммуникации": "Асфальтированная дорога\n\nЭлектричество\n\nКанализация септик\n\nСкважина",
			"Инфраструктура (до 500 метров)": "Отделение банка\n\nбанкомат\n\nАптека\n\nБольница\n\nполиклиника\n\nРынок\n\nПарк\n\nзелёная зона\n\nДетская площадка",
			"Ландшафт (до 1 км.)": "Холмы\n\nОзеро\n\nГоры\n\nПарк",
			"price": "60 000 $",
			"description": "Объявление от    Частного лица         Выберите рубрику    Продажа домов           Без комиссии    Без комиссии         Возможность обмена               Готов сотрудничать с риэлторами    Готов сотрудничать с риэлторами         Расстояние до ближайшего города    до 15 км.           Этажность   1        Общая площадь   130 м²          Количество комнат   6        Площадь участка   10 соток          Тип дома    Дом         Год постройки / сдачи    Не этапе строительства           Тип стен    Газоблок         Внешнее утепление стен    Минеральная вата           Тип кровли    Металлочерепица         Санузел    2 и более           Отопление    Собственная котельная         Коммуникации    Асфальтированная дорога  Электричество  Канализация септик  Скважина           Инфраструктура (до 500 метров)    Отделение банка  банкомат  Аптека  Больница  поликлиника  Рынок  Парк  зелёная зона  Детская площадка         Ландшафт (до 1 км.)    Холмы  Озеро  Горы  Парк                                                                                          Дом с шикарным видом на березовую рощу в с.Рославичи, Васильковского района. Расположен на участке 10 соток.  Общая площадь дома - 130 кв.м. (первый этаж - 95 кв.м., мансардный этаж - 35 кв.м.).  Живописная местность, за которую Рославичи называют «Васильковскими Карпатами».  Отличная транспортная развязка.  Дом находится в окружении красивой природы, рядом озеро, детская площадка, церковь, магазин.  К дому уже подведен свет! Сейчас делаются отмостки, канализация(септик),скважина,забор,после этих работ : окна, двери, фасады,будет сделан нормальный подьезд, водостоки и черновые полы... + участок 10 соток. За более подробной информацией обращайтесь по указанным контактам.  ХОЗЯИН. Цена -  от 60 000 у.е. Смотрите другие мои объявления!",
			"images": 5,
			"location": "Рославичи, Киевская область, Васильковский район\n                        \n                            Показать на карте"
	},
	"https://www.olx.ua/obyavlenie/srochno-dom-v-puhovke-zayti-i-zhit-IDE0fSX.html#f7065a9d45": {
		"link": "https://www.olx.ua/obyavlenie/srochno-dom-v-puhovke-zayti-i-zhit-IDE0fSX.html#f7065a9d45",
			"Объявление от": "Бизнес",
			"Выберите рубрику": "Продажа домов",
			"Без комиссии": "",
			"Возможность обмена": "",
			"Готов сотрудничать с риэлторами": "",
			"Этажность": "1",
			"Общая площадь": "130 м²",
			"Количество комнат": "4",
			"Площадь участка": "25 соток",
			"Тип дома": "Дом",
			"price": "43 000 $",
			"description": "Объявление от    Бизнес         Выберите рубрику    Продажа домов           Без комиссии             Возможность обмена               Готов сотрудничать с риэлторами             Этажность   1          Общая площадь   130 м²        Количество комнат   4          Площадь участка   25 соток        Тип дома    Дом                                                                                          с.Пуховка, ул.Шевченка, кирпичный дом площадью 130кв.м, четыре комнаты, есть печное отопление, газовый котел, бойлер. Удобства в доме. Хорошее состояние. Земельный участок 25 сот, огражден. Сад, беседка, хозпостройки: сарай, погреб. Асфальтированная улица, рядом остановка транспорта, школа, магазины. Цена: 43т.у.е. с торгом!",
			"images": 5,
			"location": "Пуховка, Киевская область, Броварской район\n                        \n                            Показать на карте"
	},
	"https://www.olx.ua/obyavlenie/srochno-dom-v-puhovke-zayti-i-zhit-IDE0fSX.html#f7065a9d45;promoted": {
		"link": "https://www.olx.ua/obyavlenie/srochno-dom-v-puhovke-zayti-i-zhit-IDE0fSX.html#f7065a9d45;promoted",
			"Объявление от": "Бизнес",
			"Выберите рубрику": "Продажа домов",
			"Без комиссии": "",
			"Возможность обмена": "",
			"Готов сотрудничать с риэлторами": "",
			"Этажность": "1",
			"Общая площадь": "130 м²",
			"Количество комнат": "4",
			"Площадь участка": "25 соток",
			"Тип дома": "Дом",
			"price": "43 000 $",
			"description": "Объявление от    Бизнес         Выберите рубрику    Продажа домов           Без комиссии             Возможность обмена               Готов сотрудничать с риэлторами             Этажность   1          Общая площадь   130 м²        Количество комнат   4          Площадь участка   25 соток        Тип дома    Дом                                                                                          с.Пуховка, ул.Шевченка, кирпичный дом площадью 130кв.м, четыре комнаты, есть печное отопление, газовый котел, бойлер. Удобства в доме. Хорошее состояние. Земельный участок 25 сот, огражден. Сад, беседка, хозпостройки: сарай, погреб. Асфальтированная улица, рядом остановка транспорта, школа, магазины. Цена: 43т.у.е. с торгом!",
			"images": 5,
			"location": "Пуховка, Киевская область, Броварской район\n                        \n                            Показать на карте"
	},
	"https://www.olx.ua/obyavlenie/nomer-ogoloshennya-1525-prodam-budinok-v-sel-vishenki-poryad-gnedin-IDBAdYO.html#f7065a9d45": {
		"link": "https://www.olx.ua/obyavlenie/nomer-ogoloshennya-1525-prodam-budinok-v-sel-vishenki-poryad-gnedin-IDBAdYO.html#f7065a9d45",
			"Объявление от": "Бизнес",
			"Выберите рубрику": "Продажа домов",
			"Без комиссии": "Без комиссии",
			"Возможность обмена": "",
			"Готов сотрудничать с риэлторами": "Готов сотрудничать с риэлторами",
			"Этажность": "2",
			"Общая площадь": "340 м²",
			"Количество комнат": "5",
			"Площадь участка": "15 соток",
			"Тип дома": "Коттедж",
			"price": "65 000 $ Договорная",
			"description": "Объявление от    Бизнес         Выберите рубрику    Продажа домов           Без комиссии    Без комиссии         Возможность обмена               Готов сотрудничать с риэлторами    Готов сотрудничать с риэлторами         Этажность   2          Общая площадь   340 м²        Количество комнат   5          Площадь участка   15 соток        Тип дома    Коттедж                                                                                          Продам будинок 340 м2 в селі Вишеньки, не далеко від центру села, будинок будувався для себе з використанням якісних матеріалів за європейськими технологіями, стрічковий фундамент, стіни газоблок, армопояс, металочерепиця руккі, вікна КВЕ, зроблена розводка електрики, сантехніки та опалення, стіни і стеля оздоблені гіпсокартоном, на цокольному поверсі вилита чаша під басейн і підготовлені приміщення під обладнання котельні, зручне планування, в будинку просторий камінний зал, кухня студія, їдальня, світлі спальні, 2 балкони. В селі добре розвинена інфраструктура - 6 магазинів, базар, 2 дитячих садка, 2 школи, 2 ресторани, аптека, лікарня з власним стаціонаром, зручна транспортна розв'язка до метро Бориспільська ходять маршрутки кожні 15 хвилин. Ділянка 15 соток. Ціна 65000 у.е.. Найбільший вибір будинків і ділянок. Номер оголошення № 1525. Дивіться інші оголошення автора. Більше об’єктів нерухомості на нашому сайті   http://www.sotka.net.ua/",
			"images": 5,
			"location": "Вишенки, Киевская область, Бориспольский район                            Посмотреть на карте"
	},
	"https://www.olx.ua/obyavlenie/luchshaya-tsena-na-novyy-domkorobka-na-20-sotkah-17km-ot-metro-18500u-IDCcWc3.html#f7065a9d45": {
		"link": "https://www.olx.ua/obyavlenie/luchshaya-tsena-na-novyy-domkorobka-na-20-sotkah-17km-ot-metro-18500u-IDCcWc3.html#f7065a9d45",
			"Объявление от": "Бизнес",
			"Выберите рубрику": "Продажа домов",
			"Без комиссии": "Без комиссии",
			"Возможность обмена": "",
			"Готов сотрудничать с риэлторами": "Готов сотрудничать с риэлторами",
			"Расстояние до ближайшего города": "до 15 км.",
			"Этажность": "2",
			"Общая площадь": "140 м²",
			"Количество комнат": "5",
			"Площадь участка": "20 соток",
			"Тип дома": "Дом",
			"Год постройки / сдачи": "Не этапе строительства",
			"Тип стен": "Газоблок",
			"Ремонт": "После строителей",
			"Меблирование": "Нет",
			"Бытовая техника": "Плита\n\nСтиральная машина",
			"Комфорт": "Сад\n\nогород",
			"Коммуникации": "Скважина",
			"Инфраструктура (до 500 метров)": "Магазин\n\nкиоск",
			"Ландшафт (до 1 км.)": "Лес\n\nРека",
			"price": "18 500 $",
			"description": "Объявление от    Бизнес         Выберите рубрику    Продажа домов           Без комиссии    Без комиссии         Возможность обмена               Готов сотрудничать с риэлторами    Готов сотрудничать с риэлторами         Расстояние до ближайшего города    до 15 км.           Этажность   2        Общая площадь   140 м²          Количество комнат   5        Площадь участка   20 соток          Тип дома    Дом         Год постройки / сдачи    Не этапе строительства           Тип стен    Газоблок         Ремонт    После строителей           Меблирование    Нет         Бытовая техника    Плита  Стиральная машина           Комфорт    Сад  огород         Коммуникации    Скважина           Инфраструктура (до 500 метров)    Магазин  киоск         Ландшафт (до 1 км.)    Лес  Река                                                                                          Лучшая цена на новый дом(коробка) на 20 сотках, 17км от метро: 18500у.е. Без %!!  с.Требухов, Броварской р-н.  17км до метро «Лисова» - по дороге без пробок и тянучек(Броварская Окружная + Бровары-Киев).  Новый дом(коробка).  140м2, из газоблока, крыша – металлочерепица.  20 соток c назначением «Под строительство дома».   Есть скважина для воды. Есть 2 ямы септика.  Особенно привлекателен для тех, кто хочет сам сделать  дом под Киевом без этапа черновых работ.  Современная планировка: 1 этаж: кухня-гостинная, кабинет, ванная, котельная, холл. Эркер. 2 этаж: 3 спальни, ванная, балкон над эркером. Вашей семье в этом доме будет комфортно!  18 500у.е. или лучшее предложение.  Покупатель комиссию не платит! МЛС.  Заметно ниже себестоимости! Приезжайте и оцените соотношение цена/качество. Звоните",
			"images": 5,
			"location": "Требухов, Киевская область, Броварской район\n                        \n                            Показать на карте"
	},
	"https://www.olx.ua/obyavlenie/luchshaya-tsena-na-novyy-domkorobka-na-20-sotkah-17km-ot-metro-18500u-IDCcWc3.html#f7065a9d45;promoted": {
		"link": "https://www.olx.ua/obyavlenie/luchshaya-tsena-na-novyy-domkorobka-na-20-sotkah-17km-ot-metro-18500u-IDCcWc3.html#f7065a9d45;promoted",
			"Объявление от": "Бизнес",
			"Выберите рубрику": "Продажа домов",
			"Без комиссии": "Без комиссии",
			"Возможность обмена": "",
			"Готов сотрудничать с риэлторами": "Готов сотрудничать с риэлторами",
			"Расстояние до ближайшего города": "до 15 км.",
			"Этажность": "2",
			"Общая площадь": "140 м²",
			"Количество комнат": "5",
			"Площадь участка": "20 соток",
			"Тип дома": "Дом",
			"Год постройки / сдачи": "Не этапе строительства",
			"Тип стен": "Газоблок",
			"Ремонт": "После строителей",
			"Меблирование": "Нет",
			"Бытовая техника": "Плита\n\nСтиральная машина",
			"Комфорт": "Сад\n\nогород",
			"Коммуникации": "Скважина",
			"Инфраструктура (до 500 метров)": "Магазин\n\nкиоск",
			"Ландшафт (до 1 км.)": "Лес\n\nРека",
			"price": "18 500 $",
			"description": "Объявление от    Бизнес         Выберите рубрику    Продажа домов           Без комиссии    Без комиссии         Возможность обмена               Готов сотрудничать с риэлторами    Готов сотрудничать с риэлторами         Расстояние до ближайшего города    до 15 км.           Этажность   2        Общая площадь   140 м²          Количество комнат   5        Площадь участка   20 соток          Тип дома    Дом         Год постройки / сдачи    Не этапе строительства           Тип стен    Газоблок         Ремонт    После строителей           Меблирование    Нет         Бытовая техника    Плита  Стиральная машина           Комфорт    Сад  огород         Коммуникации    Скважина           Инфраструктура (до 500 метров)    Магазин  киоск         Ландшафт (до 1 км.)    Лес  Река                                                                                          Лучшая цена на новый дом(коробка) на 20 сотках, 17км от метро: 18500у.е. Без %!!  с.Требухов, Броварской р-н.  17км до метро «Лисова» - по дороге без пробок и тянучек(Броварская Окружная + Бровары-Киев).  Новый дом(коробка).  140м2, из газоблока, крыша – металлочерепица.  20 соток c назначением «Под строительство дома».   Есть скважина для воды. Есть 2 ямы септика.  Особенно привлекателен для тех, кто хочет сам сделать  дом под Киевом без этапа черновых работ.  Современная планировка: 1 этаж: кухня-гостинная, кабинет, ванная, котельная, холл. Эркер. 2 этаж: 3 спальни, ванная, балкон над эркером. Вашей семье в этом доме будет комфортно!  18 500у.е. или лучшее предложение.  Покупатель комиссию не платит! МЛС.  Заметно ниже себестоимости! Приезжайте и оцените соотношение цена/качество. Звоните",
			"images": 5,
			"location": "Требухов, Киевская область, Броварской район\n                        \n                            Показать на карте"
	}
}